subreddit,title,selftext,score,num_comments,created_utc,url,permalink,demand_signals,matched_keywords
Ryobi,Salute to a Faithful Screwdriver HP44L,"So, this Ryobi guy is an a bit older release tool back in 2016. I bought it in 2019. 

I have used it across 2 different homes including my current one for countless little jobs and bigger projects. It has been my sole and only used screwdriver for 6 years. I have abused the heck out of it, dropped it constantly onto cement, even off a ladder a few times! I have used it WELL beyond it's torque appropriate limit, and it kept chugging along...

Until last night, ahhhhh so sad! IT FINALLY DIED! I g",2,2,1757956878.0,https://i.redd.it/cdpqw2uc4dpf1.jpeg,https://reddit.com/r/ryobi/comments/1nhs1ws/salute_to_a_faithful_screwdriver_hp44l/,['died'],['torque']
Ryobi,How do I know if a lawn mower will be sufficient for my yard before purchasing it?,"Right now I have a Toro 60V lawnmower (specifically model #21356) with a 7.5 Ah battery, and I'm pretty unimpressed by it.  I love that it's quiet and that it's not gas, and that I can complete my full yard without swapping batteries.  But it is terrible at bagging, its self-propelled capabilities are mediocre at best (which is very unfortunate given all the inclines of my yard), and it's starting to make some pretty unpleasant sounds after only a couple years, making me question its overall qua",2,10,1757904413.0,https://www.reddit.com/r/ryobi/comments/1nhafb4/how_do_i_know_if_a_lawn_mower_will_be_sufficient/,https://reddit.com/r/ryobi/comments/1nhafb4/how_do_i_know_if_a_lawn_mower_will_be_sufficient/,"['how do i', 'advice']","['lawn mower', 'battery']"
Ryobi,Rebuilt 9.6v battery questions,"I have an old Ryobi branded 9.6V battery model 1311146 from a drill kit which lost a couple of NiCd cells (I disassembled it and measured; they're threatening to leak, and near 0V).

So I sent the pack to MTO Battery and they quickly rebuilt it and sent it back.  It works great on the drill, measures 10.9V OC, yada yada.  But when I put it into my 3rd-party 9.6V charger it just gives the error blink.  My two other non-Ryobi batteries detect and charge normally; they also charge to 10.9V, and yes",2,1,1757893456.0,https://www.reddit.com/r/ryobi/comments/1nh6lo8/rebuilt_96v_battery_questions/,https://reddit.com/r/ryobi/comments/1nh6lo8/rebuilt_96v_battery_questions/,['cheap'],"['drill', 'battery']"
Ryobi,18v chainsaw,"Is the 18v 12""  chainsaw worth it? I'm not looking to be a lumberjack but for smaller stuff around the house. I have the 18v platform already and stepping up to the 40 v platform wouldn't be worth it for me I'd just get a gas saw ",2,6,1757863786.0,https://www.reddit.com/r/ryobi/comments/1ngu87i/18v_chainsaw/,https://reddit.com/r/ryobi/comments/1ngu87i/18v_chainsaw/,[],['chainsaw']
Ryobi,Part Search - RY143011VNM Pressure Washer,"I just bought a used Ryobi and when I turned her on for the first time we had a major leak out the bottom. After disassembly, I found this rubber gasketed bolt's head just fell off -- where the water was coming out. I tried to find the part on the ryobi parts site, but to no luck (link below). 

Anyone have any ideas of how to replce this piece? 

  
[https://ryobipower.ordertree.com/model?modelId=77790&brandCode=HCP](https://ryobipower.ordertree.com/model?modelId=77790&brandCode=HCP)



https:/",2,0,1757680860.0,https://www.reddit.com/r/ryobi/comments/1nf25l9/part_search_ry143011vnm_pressure_washer/,https://reddit.com/r/ryobi/comments/1nf25l9/part_search_ry143011vnm_pressure_washer/,"['how to', 'first time']",['pressure washer']
Ryobi,Replacement string trimmer head for RY15523A,"Looking for recommendations on replacement heads for my straight shaft string trimmer with arbor. I had bought a replacement knob off eBay but the threads are wrong. I also tried buying the newer, more modern head with the big Ryobi Green button, but it didn't work with my tool that has the arbor. I've seen some posts here that show replacement heads, but I need to find one that fits the arbor, doesn't break the bank, and that I can get up here in Canada.",1,0,1757697518.0,https://www.reddit.com/gallery/1nf93lj,https://reddit.com/r/ryobi/comments/1nf93lj/replacement_string_trimmer_head_for_ry15523a/,['recommend'],['string trimmer']
Ryobi,Do I need to register individual batteries that come with a kit and enter their serial numbers to make sure I get a warranty replacement if the battery dies before 3-year period?,"Or do they go by the kit's primary tool's number? Or do they not care at all?

What about the two batteries + charger package? Register each battery?",1,7,1757653585.0,https://www.reddit.com/r/ryobi/comments/1neuje0/do_i_need_to_register_individual_batteries_that/,https://reddit.com/r/ryobi/comments/1neuje0/do_i_need_to_register_individual_batteries_that/,[],['battery']
Ryobi,Options for tool repair or getting parts on a newer Ryobi sander,"Hi,

I received a PBLSD01B, the 18V ONE+ HP BRUSHLESS 5"" RANDOM ORBIT SANDER, from someone giving away a lot of Ryobi tools. I don't know who the original owner is other than I know the tool itself was new as of last year. 

When you plug in any battery, the green light flashes. I assume that it might have overheated and a part on a board, or the board itself in the sander is gone. You can't start it or get it going.

Besides some dust, the tool is in good shape.

Ryobi doesn't have a parts list",1,4,1757597966.0,https://www.reddit.com/r/ryobi/comments/1ne939q/options_for_tool_repair_or_getting_parts_on_a/,https://reddit.com/r/ryobi/comments/1ne939q/options_for_tool_repair_or_getting_parts_on_a/,"[""don't know"", 'new to', ""don't know""]","['battery', 'brushless']"
Ryobi,Ryobi 40v string trimmer gear head worn out after one season?,"Hi all,
New to the Ryobi world, but I recently bought a house and purchased a 40v string trimmer to trim the yard. I probably could've gotten away with an 18v, but I wanted the extra power and ability to get other attachments if I wanted. 

I went outside to trim today and the gear head is very clearly completely shot. Spinning up the trimmer to full speed it sounds like an air raid siren from inside the head. 

Do these typically wear out? I've only had the trimmer since February, and have a ve",1,2,1757537792.0,https://www.reddit.com/r/ryobi/comments/1ndq2jo/ryobi_40v_string_trimmer_gear_head_worn_out_after/,https://reddit.com/r/ryobi/comments/1ndq2jo/ryobi_40v_string_trimmer_gear_head_worn_out_after/,['new to'],['string trimmer']
woodworking,Custom router table,I decided I needed to replace my old Kreg router table and fence with something larger and with ample storage and better dust collection. So I designed and built this. It’s cherry on the exterior and some ash and cherry for the drawers. I finished everything with Simple Finish. The top is the Woodpecker phenolic router table top and I went with the Woodpecker SF Pro Fence. I designed and 3D printed a custom dust collection port for much better dust control than my old table. Lastly I installed f,1959,94,1757638076.0,https://www.reddit.com/gallery/1nepjwz,https://reddit.com/r/woodworking/comments/1nepjwz/custom_router_table/,['first time'],['router']
woodworking,First attempt to make something,"It's definitely not perfect and it took buying three cabinet doors for me to trim them to somewhat correct height. But given it's my first try at this it came out pretty well. But how the hell do I adjust the miter saw to cut straight, it took a lot of sanding to get somewhat straight edges.",1626,41,1757400291.0,https://www.reddit.com/gallery/1ncbsxc,https://reddit.com/r/woodworking/comments/1ncbsxc/first_attempt_to_make_something/,[],['miter saw']
woodworking,Is it worth having a large oak tree that fell processed into slabs and lumber?,"A friend had a very large oak tree come down in his back yard. It's 3'-4' in diameter in a few places. I'm in southern CA and there is only one portable sawmill service on wood mizer near me, and he's probably an hour away. I reached out to him but haven't heard back yet. My garage is my wood shop and I have what I need to break down slabs once they dry into something usable (track saw, table saw, band saw, etc). Is it worth it? Any guess what it would cost, or how they will price it? I have a c",1268,148,1757810492.0,https://i.redd.it/ze527fb211pf1.jpeg,https://reddit.com/r/woodworking/comments/1ngdhlv/is_it_worth_having_a_large_oak_tree_that_fell/,[],['table saw']
woodworking,I made a crib. Build album in comments.,"The crib for my son is finished. While not my design, I had a blast figuring out how to reverse engineer and build each piece. My wife found the design from a lovely Australian furniture website and asked if I could recreate it. After I told her absolutely not with my limited tools and small shop, I really started thinking about it and decided I wanted the challenge. 

I made it entirely out of eastern cottonwood, which I got for free; a friend of a friend’s grandfather was closing down his band",841,58,1757687988.0,https://www.reddit.com/gallery/1nf50s7,https://reddit.com/r/woodworking/comments/1nf50s7/i_made_a_crib_build_album_in_comments/,['how to'],['drill']
woodworking,"Simple Little Razor Holder - 4 wood parts, no glue","I've made plenty of things, but this might be my first true hand cut mortise and tenon.  No glue or fasteners--just 4 separate pieces of wood.

Katalox.  Walnut Dowels.  BLO finish.

ps, does it count as hand cut if I used a drill press to rough out the mortise?",821,18,1757604178.0,https://www.reddit.com/gallery/1nebots,https://reddit.com/r/woodworking/comments/1nebots/simple_little_razor_holder_4_wood_parts_no_glue/,[],['drill']
woodworking,Can somebody tell me what this is?,Newer to woodworking and I bought a miter saw from some older guy on Facebook marketplace and he said I could have a few things for free. This is one of them and I’m not exactly sure what to use it for. I obviously know it’s for a table saw and it’s some kind of blade but beyond that I’m not sure. ,491,297,1757889417.0,https://i.redd.it/j6qhin7ij7pf1.jpeg,https://reddit.com/r/woodworking/comments/1nh53wt/can_somebody_tell_me_what_this_is/,[],"['miter saw', 'table saw', 'blade']"
woodworking,How it started and how it's going,"Keep seeing people showing killer ""my first project"" posts. Well my first project made in my garage with a circular saw and a pocket hole jig was utter crap. I am pleased with what I did 5 years later.",386,5,1757546024.0,https://i.redd.it/c8k78xoh6fof1.jpeg,https://reddit.com/r/woodworking/comments/1ndt9xr/how_it_started_and_how_its_going/,[],['circular saw']
woodworking,"There are many first hardcut bowties like this, but this one is mine","Seeing the awesome projects here, this is not that impressive, but I'm quite proud! Cut the bow tie out of mahogany and the mortise in an oak offcut from an old kitchen top.
Took 1.5 hours overall. All done with a basic saw, a Stanley plane, and some chisels. 
Left some small gaps around the sides, decided not to fill them since it's just for practice.
It was fun, but I recon next time I just 3d print some templates and use a router.",267,7,1757713746.0,https://www.reddit.com/gallery/1nffynd,https://reddit.com/r/woodworking/comments/1nffynd/there_are_many_first_hardcut_bowties_like_this/,[],['router']
Carpentry,Some madlad carpenter in 1988 enclosed a tree inside the house. Next owners didn't maintain the enclosure and damage ensued ...,"I thought the building envelope flair would be most appropriate since the tree penetrated the building envelope in two places!

Anyways I'm just a decent DIY homeowner that bought a house with a tree growing through it. I know it was a carpenter from 1988 that did it; since I found date-stamped plywood underneath the gravel bed, and a smoked Marlboro Gold and spent match underneath that ply, ha! I've only seen super-skilled carpenters smoke Golds ...

Anyways, I love following this sub in order ",227,71,1757944693.0,https://www.reddit.com/gallery/1nhmldb,https://reddit.com/r/Carpentry/comments/1nhmldb/some_madlad_carpenter_in_1988_enclosed_a_tree/,[],['chainsaw']
Carpentry,First time building lattice wall. How did I do?,"This is the first of two lattice walls I'm making (parts of an arch tunnel I am going to put up in the spring)

I cut all the lattice myself on the table saw, don't ask how long it took or how sketchy it was either...",112,29,1757896794.0,https://www.reddit.com/gallery/1nh7skf,https://reddit.com/r/Carpentry/comments/1nh7skf/first_time_building_lattice_wall_how_did_i_do/,['first time'],['table saw']
Carpentry,"Pop up shop for trim or cabinets, what is your setup. Homemade, bought system or a mix?","If there are unused sawhorses on site,they will get used first.
For small items and holding trim,I use my Ridgid rolling stand...unless its holding the tablesaw. 
For scribing and tracksaw work the folding platforms get used.
For larger work I use Bora centipedes (3) with  1/2 plywood, 2x4,4x6,and 4x8.
Collapsing camping trashcan,20 foot vacuum hoses,folding canopy and clamps make everything work....and also takes minimal room when packing up.
Interested in learning what works for you?
3 folding",11,11,1757894312.0,https://www.reddit.com/gallery/1nh6wto,https://reddit.com/r/Carpentry/comments/1nh6wto/pop_up_shop_for_trim_or_cabinets_what_is_your/,[],['vacuum']
HomeImprovement,Am I crazy to DIY hole in granite?,"I need an extra hole in the kitchen sink portion of the granite.  Called for a company to do it and it’s upward of $300 to get one hole drilled. Diamond drill
bit is around $45. I’ve watched videos and it seems simple enough although technique is needed, I get it. 
Am I crazy? ",97,179,1757732589.0,https://www.reddit.com/r/HomeImprovement/comments/1nfmnn4/am_i_crazy_to_diy_hole_in_granite/,https://reddit.com/r/HomeImprovement/comments/1nfmnn4/am_i_crazy_to_diy_hole_in_granite/,[],['drill']
HomeImprovement,A simple framework for choosing the right exterior paint color (and avoiding a costly mistake),"**How to Choose the Right Exterior Color, The First Time.**

Don't choose your exterior paint color in a vacuum. To get it right, follow this simple framework that focuses on what's already there.

* **Start with Your ""Fixed Elements.""** \> Your roof, stone, and brick aren't changing. Your new paint color must complement them. This is the foundation of a great color choice.
* **Identify the Undertones.** \> Look closely at your brick or stone. Are the underlying colors warm (orange, tan, pink) o",5,3,1757865655.0,https://www.reddit.com/r/HomeImprovement/comments/1ngv0vh/a_simple_framework_for_choosing_the_right/,https://reddit.com/r/HomeImprovement/comments/1ngv0vh/a_simple_framework_for_choosing_the_right/,"['how to', 'first time']",['vacuum']
HomeImprovement,Weeds in asphalt,"I have a ton of weeds growing out of the cracks in my driveway (about a mile-long driveway). What is the best way to get rid of them? I have been using a weed eater, then spraying them with weed killer, but it is taking a lot of time. Any better approaches?",6,20,1757696536.0,https://www.reddit.com/r/HomeImprovement/comments/1nf8on3/weeds_in_asphalt/,https://reddit.com/r/HomeImprovement/comments/1nf8on3/weeds_in_asphalt/,[],['weed eater']
HomeImprovement,Securing bowling alley chairs in my living room,"I just picked up some old bowling alley chairs and they were originally bolted down at the alley. I want to use them in my living room but I’d rather not drill into my floor. What can I do to keep them from tipping when people sit down? (Besides having 2 people sit at the same time!)

https://imgur.com/a/sR5Jcim",4,6,1757727767.0,https://www.reddit.com/r/HomeImprovement/comments/1nfl2xr/securing_bowling_alley_chairs_in_my_living_room/,https://reddit.com/r/HomeImprovement/comments/1nfl2xr/securing_bowling_alley_chairs_in_my_living_room/,[],['drill']
DIY,Can I Anchor This Carport Into This Retaining Wall?,"Planning a lean to carport on the side of my house, along with installing a concrete driveway and grading away from the side of the house and to the road. There is a very sturdy concrete wall on one side - 10 inches deep, very straight, no cracks or failure. It is older and rougher aggregate. Can I drill into this thing to set my support posts on that side or do I need to dig on the far side of it and add new footers for posts?",711,266,1757438656.0,https://www.reddit.com/gallery/1ncp406,https://reddit.com/r/DIY/comments/1ncp406/can_i_anchor_this_carport_into_this_retaining_wall/,[],['drill']
DIY,"DIY Sanding Disc Holder – Simple, Cheap, and Functional (~7€ build)","I’ve been looking for a proper way to store my sanding discs for quite a while. Most of the ideas I found online were either visually boring (just a plain box with thin dividers) or way too expensive. Even the few affordable commercial options run close to 30€ for only 8 compartments.

So, I decided to make my own inexpensive and simple version. Here’s what I came up with — the whole thing cost me about 7€.


---

Materials

500mm sewage pipe (Ø160 mm) – ~4€

10mm thick plywood offcut from the h",567,31,1757521042.0,https://www.reddit.com/gallery/1ndiohy,https://reddit.com/r/DIY/comments/1ndiohy/diy_sanding_disc_holder_simple_cheap_and/,"['cheap', 'expensive', 'expensive', 'cheap', 'small space']","['drill', 'jigsaw', 'cordless']"
DIY,Bookself guardrail solidity,"Hi! 

I want to build a bookself ramp like in the first picture (not mine) instead of the original one in my bungalow. I have some pictures of how it's currently. Picture 2&3, sorry for the mess I have kids 😂 

Is there a preferred way to fastened it in the floor? I've seen two ways but I'm not sure if there's one better than the other and if it would work with my setup: 

- Make a box with 2x4 and drill them in the floor with woodscrews and then drill the bookshelves in the 2x4.
- Wooden or met",159,14,1757607135.0,https://www.reddit.com/gallery/1necy8w,https://reddit.com/r/DIY/comments/1necy8w/bookself_guardrail_solidity/,['advice'],['drill']
DIY,How do I make this look better?,"I had a kitchen center design and make inexpensive cabinets and I had my contractor install them.  When it come to the microwave I am at a loss on how to fix this.

Kitchen center said that the plans were designed so the cabinets went all the way to the ceiling bu that would have had the cabinets about 21"" from the counter top and not level with the dropped ceiling.

The contractor installed the cabinets at 19"" above the countertop and with no cabinet to mount the microwave to, he added lumber a",56,81,1757547520.0,https://www.reddit.com/gallery/1ndtte7,https://reddit.com/r/DIY/comments/1ndtte7/how_do_i_make_this_look_better/,"['how do i', 'how to', 'expensive']",['microwave']
DIY,Oven not level.,"Living in a rented apartment, and I’ve just pulled out the oven to clean behind. Long story short some food was behind there it was disgusting back there from before we moved in. I’ve cleaned it all out etc. My question is that the floor isn’t level, we have lament tile effect down in the kitchen but this has only been laid up to slot of the oven. Subsequently the oven doesn’t sit level oil flows down to a corner in pans etc. Could I put cardboard under the oven to bring it up to sit level with ",32,8,1757607049.0,https://www.reddit.com/gallery/1necwvx,https://reddit.com/r/DIY/comments/1necwvx/oven_not_level/,['apartment'],['oven']
DIY,Metal stud TV mount,SOS people. Attempted helping my friend mount his TV into metal studs. Prepared with toggle bolts & proper hardware to complete. Only issue is getting through these “metal” studs. They seem to be much thicker. They almost seem to be steel. Using brand new 1/2 bits with both impact & pre driller. It’s an apartment complex & we’ve noticed others have their tv mounted on the wall. ANY advice or experience with similar issue would be appreciated. Thank you,25,37,1757773508.0,https://www.reddit.com/r/DIY/comments/1nfysz6/metal_stud_tv_mount/,https://reddit.com/r/DIY/comments/1nfysz6/metal_stud_tv_mount/,"['advice', 'apartment']",['drill']
DIY,Need help hooking up a p-trap with garbage disposal,"I am in the process of replacing my kitchen sink, going from double bowl to single bowl sink. The single bowl sink is a bit deeper than the dual bowl sink and I have ran into a problem where the garbage disposal tail pipe is too low as can be seen in the first picture. 

1. I would like to know what can be done here to get this all hooked up. I have read other threads about lowering the drain pipe coming from the wall but I’m exploring  options that are less invasive and hardware store friendly.",24,49,1757480118.0,https://www.reddit.com/gallery/1nd599b,https://reddit.com/r/DIY/comments/1nd599b/need_help_hooking_up_a_ptrap_with_garbage_disposal/,['need help'],['drill']
electricians,"Whats your favorite, harmless jobs items prank?","Whats your favorite prank to pull on other trades that are harmless and dont cause feuds. 

My favorite is flipping the bandsaw blade inside out. ",63,120,1757545678.0,https://www.reddit.com/r/electricians/comments/1ndt5bj/whats_your_favorite_harmless_jobs_items_prank/,https://reddit.com/r/electricians/comments/1ndt5bj/whats_your_favorite_harmless_jobs_items_prank/,[],['blade']
electricians,Remodeling the kitchen!,"After 20 years in the trade, I saw a new one today. Turns out when you remodel a kitchen, you can just feed everything off the oven circuit.",48,27,1757383586.0,https://i.redd.it/760y992or1of1.jpeg,https://reddit.com/r/electricians/comments/1nc6rt8/remodeling_the_kitchen/,[],['oven']
Plumbing,UPDATE: Today is fucked,"Thought I’d pass on an update and a couple stupid things I did to my last post. If you saw it, you probably laughed at my misfortune. If you didn’t, knock yourself out: 

https://www.reddit.com/r/Plumbing/s/xSUy7CvbBk

Plumbing was completed today. Took me two hours. 25’ of pipe that I somehow maneuvered into the existing hvac/plumbing/framing in 5’ increments. 

Like a true fucking man, I inhaled some glue, rubbed some primer in my wounds, told the kids to treat the wife well, and put on my mas",1263,62,1757897507.0,https://i.redd.it/z1aqj6bt78pf1.jpeg,https://reddit.com/r/Plumbing/comments/1nh819y/update_today_is_fucked/,[],['air compressor']
Plumbing,TIL Plumbers don't make nearly enough money: Part 2. The pump is out.,"Thanks to everyone from part 1 that got me this far, especially  u/poebahnya and u/CapPretend6677.

So the pump is out of the well.  It's a Bell and Gossett 126S2012L, which I have read belongs to the 12GS series  from Xylem.

Neither the blades nor the impeller appeller appear clogged.  From reading the manual, it doesn't look like anything would be behind the blade.  Should I remove it to see?  Can it get clogged behind the blade from hair?

The manual I've found on the Xylem website isn't ver",31,38,1757778097.0,https://www.reddit.com/gallery/1ng0p37,https://reddit.com/r/Plumbing/comments/1ng0p37/til_plumbers_dont_make_nearly_enough_money_part_2/,[],['blade']
Plumbing,Garbage disposal leaking from bottom near power cable?,"I’ve got an InSinkErator Badger disposal under my kitchen sink. Recently I noticed water dripping out of the bottom of the unit where the power cable enters through the strain relief clamp. It gets worse when I run water in the sink or turn on the disposal.

I’ve checked the sink flange, dishwasher hose, and drain connections — none of those are wet. The only place water shows up is at the bottom electrical knockout.

From what I understand, this means the internal seals are shot and the disposa",14,42,1757459891.0,https://www.reddit.com/gallery/1ncyco8,https://reddit.com/r/Plumbing/comments/1ncyco8/garbage_disposal_leaking_from_bottom_near_power/,[],['dishwasher']
lawncare,Before & after sharpening my blade SC,"Just started learning about the blade from you all. What a difference it makes, thanks for bringing another person out of the dark ages of lawn care",477,47,1757676679.0,https://i.redd.it/iq5zxgw0ypof1.jpeg,https://reddit.com/r/lawncare/comments/1nf0pjb/before_after_sharpening_my_blade_sc/,[],['blade']
lawncare,My Recent Lawn Renovation Project,"Hey all,

**Northeast - Long Island, NY**

Figured I'd post a little rundown on what I did this past month to renovate my lawn, since it looks like it's working pretty well.

**A little background:**

Basically, I had been trying to rehabilitate my lawn (Approx. 4000sqft) for the past 3 seasons.  Unfortunately, due to not having consistent watering combined with the ridiculously hot and dry summers here on Long Island, it went by the wayside this past summer and I threw in the towel and decided ",342,41,1757625029.0,https://www.reddit.com/gallery/1nekq97,https://reddit.com/r/lawncare/comments/1nekq97/my_recent_lawn_renovation_project/,[],['tiller']
lawncare,"Very nervous, but done the first mowing after overseeding on day 18, what's next?","I am in 4b. Overseeded on Aug 25th for the back lawn with resilience 2 and strong creeping red fescues mixed a little cause this area doesn't get a lot of sunlight, and it came out great. Germination started on day 5 and continue for 14+ days. Now new seedlings go from 2.5 to 4 inches. 

I scalped the lawn to about 2 inches before overseeding but with everyday watering and starter fertilizer, the existing lawn started to grow fast. Did a little research seeing that people have successful experie",219,96,1757635540.0,https://www.reddit.com/gallery/1neooo7,https://reddit.com/r/lawncare/comments/1neooo7/very_nervous_but_done_the_first_mowing_after/,['advice'],['push mower']
