subreddit,title,selftext,score,num_comments,created_utc,url,permalink,demand_signals,matched_keywords
Plumbing,Dishwasher causing geyser out of airgap,"Running the dishwasher causes water to launch out the airgap, it usually has that cap on it but with it on it just shoots out the slots. 

I read it could be a clog between the airgap and garbage disposal so I took that hose out and removed some solid plugs of crap, but on a retest water is still shooting out. Seems like pressure from the dishwasher.

We don’t have a high loop into the dishwasher, could that be it?

The line goes dishwasher > airgap > garbage disposal 

This can’t be intended ha",9,32,1758654687.0,https://v.redd.it/c9w5f4uaryqf1,https://reddit.com/r/Plumbing/comments/1noqfcu/dishwasher_causing_geyser_out_of_airgap/,[],['dishwasher']
lawncare,What's wrong with my lawn?,"Located in northeastern Pennsylvania. I've had issues with my lawn turning brown in late summer, particuarly now in August/September, it's become a very noticeable issue only in the last couple of years. Throughout the lawn most of the grass grows in a way where each ""blade"" of grass grows as a brown stem with small, separate offshoot blades of green grass growing off of top of this visible brown stem, rather than just being normal individual green baldes growing out from the soil. I do not regu",71,44,1758565236.0,https://www.reddit.com/gallery/1nnu91b,https://reddit.com/r/lawncare/comments/1nnu91b/whats_wrong_with_my_lawn/,['help with'],['blade']
AutoDetailing,Completed My First Professional Interior Detail Today.,"2006 Lexus GX470. 

- 3D APS for initial clean down
- P&S Swift for final wipe and dressing
- P&S Terminator, then Carpet Bomber, then Finisher Peroxide for the carpets, used a drill brush and shop vac
- Pro leather cleaner and conditioner ",31,7,1758861799.0,https://www.reddit.com/gallery/1nqsaqk,https://reddit.com/r/AutoDetailing/comments/1nqsaqk/completed_my_first_professional_interior_detail/,[],['drill']
AutoDetailing,Tried to detail and created some micro scratches unfortunately,"Trying to figure out how bad and where I went wrong. 


I went to a wash bay. Used the pressure washer (no brush use) to wash the dirt of the car and dried with Microfiber towers. 

After I used a clay bar kit from Maguires. It seemed to remove a ton of leftover stuff. 

I finished with Griots 3-1 wash and wax. Also used micro fiber towels. 

I think I might not have washed the car clean enough before the dry and clay bar. In the Future should I clay bar without drying? 

Can these scratches be ",21,12,1758568517.0,https://i.redd.it/n9nysmu2nrqf1.jpeg,https://reddit.com/r/AutoDetailing/comments/1nnvprh/tried_to_detail_and_created_some_micro_scratches/,[],['pressure washer']
AutoDetailing,"Did a complete restoration of my first ever car, bought 14 years ago. Complete detail in description.","The reason i don't have before photos is cause i was certain that i had clicked them 2 months ago but somehow that folder was deleted so I'm adding the 4th photo as a reference of how bad the paint was, this was the kind of oxidation that was on the whole boot and the roof of the car, the paint was in pretty bad shape. Couldn't see through the oxidation.

This took a total of 8 hours.
First of all i started with a full decontamination wash with koch chemie green star, later i clayed the whole ca",23,6,1758529771.0,https://www.reddit.com/gallery/1nngxpy,https://reddit.com/r/AutoDetailing/comments/1nngxpy/did_a_complete_restoration_of_my_first_ever_car/,[],"['drill', 'cordless']"
AutoDetailing,Active 2.0 opinions,I’ve been getting into detailing and looking for my first pressure washer everyone keeps talking about the active 2.0 but anytime I see reviews or comments on videos/posts on this washer it’s filled with people talking about them failing prematurely like within a month or 30hrs of work when these machines are rated at 250hrs should I be worried about reliability? Do I opt for another machine? ,21,55,1758437566.0,https://i.redd.it/rxv0pmzotgqf1.jpeg,https://reddit.com/r/AutoDetailing/comments/1nml1n1/active_20_opinions/,[],['pressure washer']
AutoDetailing,Think I got an absolute steal. 8 gallon air compressor.,"Was in the market for an air compressor and found this steal for…. $15. Works perfectly, no problems. Owner was an older guy who just didn’t need it. 

I’m new to interior detailing, what is the best product I can get to maximize my time while cleaning? How effective can this 8 gallon tank be? Tips, tricks, and recommendations are appreciated! ",18,6,1758768593.0,https://i.redd.it/9dy0oc8068rf1.jpeg,https://reddit.com/r/AutoDetailing/comments/1npvmlj/think_i_got_an_absolute_steal_8_gallon_air/,"['recommend', 'new to']",['air compressor']
AutoDetailing,Switching from car shampoo to rinseless,"I have enjoyed washing my car for the past year and have all the equipment needed to wash my car with shampoo. I have a power washer and a foam cannon that I like to use. I recently saw rinse less wash and wanted to give it a shot now that I am low on shampoo. 

Can I use my foam cannon and pressure washer to apply the rinse less or would I need to get a pump sprayer? I’d like to avoid buying more equipment. 

I was planing on buying the rinseless and a sponge for that. For my washing process I ",17,14,1758753478.0,https://www.reddit.com/r/AutoDetailing/comments/1npqa83/switching_from_car_shampoo_to_rinseless/,https://reddit.com/r/AutoDetailing/comments/1npqa83/switching_from_car_shampoo_to_rinseless/,[],['pressure washer']
MechanicAdvice,"My car keys are stuck in the insert. My car wont start. I went to get this exact problem fixed 6 months ago and car shop said they replaced a ""piggy"" wire & charged me $900. Is there anything i can do to fix it this time?","2009 chevy impala,, idk the engine.  

I dont know what a piggy wire is. Thats what they told me it was through text and i stupidly didnt keep a receipt.  

The keys are stuck in the ""accessory"" mode and will turn towards ""start"" but the engine wont turn over, no sound at all comes from from the engine. No accessory lights turn on, no lights at all turn on. Windows dont work. I think my battery might be dead but i wouldnt know, i dont know anything about cars. At this point ripping it apart by m",331,89,1758509095.0,https://i.redd.it/c072ddadqmqf1.jpeg,https://reddit.com/r/MechanicAdvice/comments/1nnb2um/my_car_keys_are_stuck_in_the_insert_my_car_wont/,['advice'],['battery']
MechanicAdvice,"Threads are dead , how do I get this bolt off my ball joint?","I need to get the ball joint out again because I overtightened the balll joint bolt when replacing the control arm. I spread or shredded the threads and now it’s just spinning. If i save the stud, I can replace a new bolt with loctite. Or I can get a new ball joint pressed in.

My grinder doesn’t fit, the multi tool blade won’t hack it, I tried putting pressure up with a prybar on the steering knuckle to have it catch the threads.

2010 dodge gc 3.8 245k miles",67,106,1758736498.0,https://i.redd.it/h6hqxcdki5rf1.jpeg,https://reddit.com/r/MechanicAdvice/comments/1npj301/threads_are_dead_how_do_i_get_this_bolt_off_my/,['how do i'],['blade']
MechanicAdvice,Make it make sense “auto start/stop” economy math,"So my 2021 jeep grand Cherokee has stopped its start/stop thing at stop lights.  From what I can tell it’s the secondary battery that is getting weak so if I drive a longer trip ~30+ minutes, it starts working again.  

So I did the math.  If I have to replace the battery every 5 years, I drive about 5k miles a year, and from what the fuel economy looks like it saves about 1 mpg.  (21 vs 22) driving around town.  Calculate that out at $2.80 a gallon, I’m saving about $30 a year.  But if the repl",65,181,1758669565.0,https://www.reddit.com/r/MechanicAdvice/comments/1nowmb2/make_it_make_sense_auto_startstop_economy_math/,https://reddit.com/r/MechanicAdvice/comments/1nowmb2/make_it_make_sense_auto_startstop_economy_math/,['stopped'],['battery']
MechanicAdvice,Am I Toast?,"First oil change in this car. Put about 4k miles on it since buying 6 months ago. 2011 chevy cruze, 1.8 non turbo, manual transmission. 185k miles. Large flakes and metal curls? I sent pics to my mechanic and he says it looks more like machining leftovers from a repair or drill rather than wear/failure. Car runs perfectly. Any thoughts? Should I ditch it before it strands me on the side of the road? Ride it out for awhile and see? I only paid $1700 for it so it's not the biggest deal but it's be",61,43,1758664784.0,https://www.reddit.com/gallery/1nourm0,https://reddit.com/r/MechanicAdvice/comments/1nourm0/am_i_toast/,[],['drill']
MechanicAdvice,"Drilling out these studs is a pain due to hardned steel, anyone got tips??",,27,55,1758442360.0,https://i.redd.it/pwrrlx0t7hqf1.jpeg,https://reddit.com/r/MechanicAdvice/comments/1nmmbmi/drilling_out_these_studs_is_a_pain_due_to_hardned/,[],['drill']
appliances,Are there no decent refrigerators left in this cruel world?,"Yes I’m being dramatic…but also I’m so lost on what refrigerator to purchase! Obviously everything will have some bad reviews. 

TLDR: We have 2 refrigerators. Our main fridge broke recently. The other one is very basic bottom of the line, pretty small, works but we need filtered water and an ice maker. Need help or advice finding a new one! 


This is the situation: 

We’ve had our French door, water dispenser on the outside, whirlpool fridge for about 5.5 years. Now it won’t stop beeping and w",2533,1026,1758602475.0,https://www.reddit.com/gallery/1no89k6,https://reddit.com/r/Appliances/comments/1no89k6/are_there_no_decent_refrigerators_left_in_this/,"['advice', 'advice', 'need help', 'budget', 'cheap']",['refrigerator']
appliances,I have made the best purchase of my life.,"I looked it up, dishwashers are appliances, do counter-top dishwashers count for this subreddit? I hope so.

My aunt recommended this to me, and my god, I haven't had a full set of clean dishes in months. I always just rewashed the same cutlery/plates over and over because of work, college (I'm 19) and I'm lazy.

God, I sound so much like my dad it's crazy.

(I've never owned/saw any type of dishwasher before in my life, in person, until this point.)",1211,152,1758735507.0,https://www.reddit.com/gallery/1npinn0,https://reddit.com/r/Appliances/comments/1npinn0/i_have_made_the_best_purchase_of_my_life/,['recommend'],['dishwasher']
appliances,Roach in the screen of my oven clock… am I screwed?,"For reference, I live in an apartment complex that is supposed to be “Luxury”, according to them. The complex itself was built probably 10 years or less ago, so fairly new. They do regular pest control once every like 6 months where they come in and spray chemicals around our unit and building to deter pests. But, I woke up this morning and to my surprise, noticed a roach moving around behind the screen of my oven clock! I am a very clean and tidy person, I don’t leave dishes in the sink for lon",558,106,1758817089.0,https://i.redd.it/2m7fb2l76crf1.jpeg,https://reddit.com/r/Appliances/comments/1nqb4wz/roach_in_the_screen_of_my_oven_clock_am_i_screwed/,"['advice', 'apartment']","['dishwasher', 'oven', 'microwave', 'vacuum']"
appliances,Impulse Cooktop Initial Impressions,"I recently redid my kitchen and put in an Impulse induction cooktop.  They’re very new and it’s hard to find much info on them, so I figured I’d share my thoughts.

I’m not affiliated with Impulse in any way.  Bought the unit on my own, decided to share my thoughts independently.

For context, I’ve always cooked on gas.  I cook a wide variety of foods, rarely the same thing twice.  I’ve dabbled in induction cooktops before, but not a lot.

I was ultimately motivated to switch from gas for the in",180,17,1758671190.0,https://www.reddit.com/r/Appliances/comments/1nox7zk/impulse_cooktop_initial_impressions/,https://reddit.com/r/Appliances/comments/1nox7zk/impulse_cooktop_initial_impressions/,[],['battery']
appliances,Why does my oven have an ethernet port?,,100,70,1758493554.0,https://i.redd.it/oawidre5glqf1.jpeg,https://reddit.com/r/Appliances/comments/1nn5kzk/why_does_my_oven_have_an_ethernet_port/,[],['oven']
appliances,Washing machine stinks,What is the easiest way to make our machine smell good?,99,267,1758455667.0,https://v.redd.it/cjfo7ztgbiqf1,https://reddit.com/r/Appliances/comments/1nmpzdh/washing_machine_stinks/,[],['washing machine']
appliances,anybody know what this black liquid is in my microwave?,"we've been seeing this black liquid in our microwave. It's a bit viscous but doesn't quite seem like grease from food. It always gets pooled on the right side of the microwave. I can't really seem to figure out where it's coming from except a tiny spot in the top where it might be dripping down but there's no hole there afaik. I'm guessing i'll have to replace this microwave but just wanted to see if anyone can help me figure it out 

",89,62,1758728506.0,https://i.redd.it/yh3qycohu4rf1.jpeg,https://reddit.com/r/Appliances/comments/1npfjy0/anybody_know_what_this_black_liquid_is_in_my/,[],['microwave']
appliances,Wife put a mug of bacon grease in the dishwasher,"My wife somehow failed to notice that I had filled a coffee mug ~1/2 full with bacon grease, which had solidified, and put it in the dishwasher and ran a cycle. Everything obviously came out covered in grease so we ran again and the dishes seem fine, but I’m worried about long-term effects to the drain/pump/pipes. Anyone have any experience with something like this?",70,61,1758665400.0,https://www.reddit.com/r/Appliances/comments/1nov0k6/wife_put_a_mug_of_bacon_grease_in_the_dishwasher/,https://reddit.com/r/Appliances/comments/1nov0k6/wife_put_a_mug_of_bacon_grease_in_the_dishwasher/,['failed'],['dishwasher']
appliances,Confused about what kind of washing machine i own,I purchased a refurbished washing machine when I bought my current home 4 years ago from someone in my area that is well known for selling refurbished appliances and does FANTASTIC work. In the last couple of weeks my washing machine has stopped filling all the way no matter which water level setting you choose. I've taken the hoses off the back and made sure there are no kinks in them and that the sediment filters were clean but that didn't fix the problem. My next thought is that the water fil,66,38,1758556682.0,https://www.reddit.com/gallery/1nnqdzg,https://reddit.com/r/Appliances/comments/1nnqdzg/confused_about_what_kind_of_washing_machine_i_own/,"['how do i', 'stopped']",['washing machine']
appliances,The small but mighty!,"Recently got this guy! Our budget rental doesn’t have a dishwasher and I’ve wanted one for 4 years. It’s just my husband and I but dishes pile up. Highly recommend! 

I use a high quality dish pod and it cuts through sticky honey Asian sauce like nothing. It comes with a pitcher to fill it with or connect to sink. (I use pitcher). Drain hose to the sink. It even dries! Cycle with dry is 2hrs or rapid without dry is 40min. ",53,23,1758907660.0,https://www.reddit.com/gallery/1nr7gti,https://reddit.com/r/Appliances/comments/1nr7gti/the_small_but_mighty/,"['recommend', 'budget', 'rental']",['dishwasher']
appliances,SOS!! Washing Machine Shaking!,"Just bought this brand new washer and dryer this is the second time trying to do a load in the washing machine and this keeps happening the floor is level/even and we put the feet on the washing machine, the drum does not seem to be loose so how can we fix this? Please help 😭😭😭😭
",53,73,1758648930.0,https://v.redd.it/rct944q6ayqf1,https://reddit.com/r/Appliances/comments/1nonvao/sos_washing_machine_shaking/,[],"['washing machine', 'dryer']"
appliances,Bosch 800 dish washer - died after 5 years - but did I cause its death?,"I bought a Bosch 800 dish washer after having an (old) Whirlpool that really never got dishes clean.  The Bosch lasted 5 years until it suddenly no longer works.  No certified Bosch repair people in my mid sized town/city.  When calling repair people, I was asked ""How long do you expect a dish washer to last!!!???!!""  This reminded me of the responses I got when trying to get the old Whirlpool fixed.  On those calls, I was told that a dish washer is meant to last 5 to 7 years, so if I got that, ",43,220,1758894629.0,https://www.reddit.com/r/Appliances/comments/1nr1vyk/bosch_800_dish_washer_died_after_5_years_but_did/,https://reddit.com/r/Appliances/comments/1nr1vyk/bosch_800_dish_washer_died_after_5_years_but_did/,"['recommend', 'died', 'died']",['dishwasher']
appliances,"New dishwasher, what is this?",Got a new dishwasher with this piece on the right side of the bottom rack. Anyone know what it is for? It folds up vertical or lays out horizontal. ,33,57,1758484975.0,https://i.redd.it/g1c6harnqkqf1.jpeg,https://reddit.com/r/Appliances/comments/1nn22et/new_dishwasher_what_is_this/,[],['dishwasher']
appliances,Dishwasher rack is rusting,"So my KitchenAid dishwasher is about 4 years old.  We're running into an issue where the racks themselves are losing the plastic coating and the wire underneath is rusting. About a year and a half ago, a piece of the wire on the top rack actually broke off and ripped apart the screen on the motor/pump housing, which turned into a fairly costly repair. I fixed the top rack with some liquid vinyl repair and some plastic wire caps, and it seems okay still, but now the bottom rack is experiencing th",33,41,1758992123.0,https://www.reddit.com/gallery/1ns07df,https://reddit.com/r/Appliances/comments/1ns07df/dishwasher_rack_is_rusting/,[],['dishwasher']
appliances,Can I drill a hole here?  LG LTCS24223S,"Hello All, I have these kegs inside my fridge, and I was wondering if I could make a 5/16"" hole in the left side, and run the air line, or dispense line through it. I'm opening the fridge 10 times a day to dispense bubble water and I'm sure its wasteful. 

Reason I ask is I don't know if the refrigerant lines are in the back wall, or sides. ",32,47,1758724207.0,https://www.reddit.com/gallery/1npdo43,https://reddit.com/r/Appliances/comments/1npdo43/can_i_drill_a_hole_here_lg_ltcs24223s/,"[""don't know""]",['drill']
appliances,Just scored a new apartment; this is the state of my Miele washer.,"I moved in a week ago, two days ago I went to use the washer for the first time and got hit with a god-awful stench. Maintenance guy came yesterday and ran a laundry bomb through it, today I actually took a good look and noticed a ton of black, hairy gunk built up in the door gasket. I dug most of it out with a bleach-soaked rag this black shit just isn’t rubbing off. It’s mold, isn’t it? Is this bad enough that an entirely new washing machine is necessary, or can this rubber be replaced on its ",31,36,1758578572.0,https://www.reddit.com/gallery/1nnzzzr,https://reddit.com/r/Appliances/comments/1nnzzzr/just_scored_a_new_apartment_this_is_the_state_of/,"['first time', 'apartment', 'apartment']",['washing machine']
appliances,Frigidaire dishwasher standing water,"Hello. I recently moved and this Frigidaire dishwasher has been a pain. 
There is disgusting standing water. I remove it by hand, but then after a wash its still there again. 
I removed all the parts and filter, cleaned them (they were not dirty to begin with), got a new arm, did the baking soda + vinegar, but its still the same. 

The water is always this level, never overflowing or spilling on the floor. And this dishwasher doesnt open by itself when done so the dishes get like a oily layer an",21,28,1758650005.0,https://i.redd.it/279de1qddyqf1.jpeg,https://reddit.com/r/Appliances/comments/1noocfu/frigidaire_dishwasher_standing_water/,[],['dishwasher']
appliances,Ever replaced something this old? Was it an easy install?,"We just moved into a fixer upper that has a dishwasher that's at least 40 years old. We can't even open it. We got a Lowe's gift card and plan to replace it ASAP, but I am not sure if we should pay for their installation services. I worry that it will be more complicated and they won't be able to do it. I've heard they don't refund the $. Has anyone ever had something this old replaced? Did you hire a plumber/electrician or was it an easy install?",17,30,1758992989.0,https://www.reddit.com/gallery/1ns0k90,https://reddit.com/r/Appliances/comments/1ns0k90/ever_replaced_something_this_old_was_it_an_easy/,[],['dishwasher']
appliances,Should I buy a “garage ready” refrigerator for my garage?,"Or, will a regular refrigerator be fine?  The garage has no heating or cooling.",17,41,1758662676.0,https://www.reddit.com/r/Appliances/comments/1notw4l/should_i_buy_a_garage_ready_refrigerator_for_my/,https://reddit.com/r/Appliances/comments/1notw4l/should_i_buy_a_garage_ready_refrigerator_for_my/,[],['refrigerator']
appliances,Buyer Beware If Buying Hisense Refrigerator,"Hello, this is a copy of my response to a post from someone who purchased the exact same Hisense refrigerator as I did. This has happened over the course of this month September 2025. And as of today, is still ongoing. Buyer Beware!

Hey how is the Hisense working for you after all this time? We have the same unit and after 1.5 years it is dead. Hisense warranty (2 yrs) sounds good, until they can't find a repair person/company willing to work on it. (Day 1 Monday) We called the number from the ",13,12,1758558699.0,https://www.reddit.com/r/Appliances/comments/1nnrarj/buyer_beware_if_buying_hisense_refrigerator/,https://reddit.com/r/Appliances/comments/1nnrarj/buyer_beware_if_buying_hisense_refrigerator/,['failed'],['refrigerator']
appliances,I have made the best purchase of my life.,"I looked it up, dishwashers are appliances, do counter-top dishwashers count for this subreddit? I hope so.

My aunt recommended this to me, and my god, I haven't had a full set of clean dishes in months. I always just rewashed the same cutlery/plates over and over because of work, college (I'm 19) and I'm lazy.

God, I sound so much like my dad it's crazy.

(I've never owned/saw any type of dishwasher before in my life, in person, until this point.)",11,2,1758735471.0,https://www.reddit.com/gallery/1npin3i,https://reddit.com/r/Appliances/comments/1npin3i/i_have_made_the_best_purchase_of_my_life/,['recommend'],['dishwasher']
appliances,Upgraded dishwasher worth it?,"We have whirlpool dishwasher, put in by builders, ~3 years old.  Needs a ~$300 repair. 

We use our dishwasher almost daily, we don’t pre wash much, just a rinse.  We use a lot of plastic with our kids and us.  We use sanitizer cycle often with heat dry.

Even with that, almost all plastic comes out wet, we have to place it in a drying rack before putting away. 

Looking at upgrading to a Bosch 800, or something similar (open to suggestions).  We want something that dries well.

$1500 price tag ",8,33,1758637786.0,https://www.reddit.com/r/Appliances/comments/1noixko/upgraded_dishwasher_worth_it/,https://reddit.com/r/Appliances/comments/1noixko/upgraded_dishwasher_worth_it/,[],['dishwasher']
appliances,Top-load washer leaving white streaks on clothes,"I moved into this house in February and this has been a constant thing. We notice it only on black clothes (probably just because they're dark). I am able to rub it off with a damp towel but it happens every wash. I have done a wash of the washing machine and installed a water softener. Sometimes, it is loose like lint (first pic) and sometimes it seems to be engrained in the fabric (second pic).

In the third pic is a dish rag which has these little white globs (texture of snot) - not sure if i",8,10,1758596036.0,https://www.reddit.com/gallery/1no68rp,https://reddit.com/r/Appliances/comments/1no68rp/topload_washer_leaving_white_streaks_on_clothes/,[],['washing machine']
appliances,My Heir refrigerator makes this annoying sound. Anyway to troubleshoot or is this normal?,,6,7,1758563792.0,https://v.redd.it/lhq4cwk09rqf1,https://reddit.com/r/Appliances/comments/1nntl03/my_heir_refrigerator_makes_this_annoying_sound/,[],['refrigerator']
appliances,My dishes chip in the dishwasher,"I have been using this Samsung dishwasher for a year and I find that my bowls tend to chip. It can happen whether they are in the higher or lower chamber. I usually place them like this so no one touches each other. I use the auto setting for wash and dishwasher pods. When I used to wash them in a Bosch dishwasher before this one they didn’t chip before. 

Any ideas? Thank you!",6,13,1758544895.0,https://i.redd.it/0if5do2uopqf1.jpeg,https://reddit.com/r/Appliances/comments/1nnldv9/my_dishes_chip_in_the_dishwasher/,[],['dishwasher']
appliances,Do you have mixed appliances brands?,Hi all! Our dishwasher broke after 7 years using it and now Im in hunting for a new one. When we built our home all the appliances that came with is from GE profile brand. Im looking for a kitchen aid stainless dishwasher (the stainless would match the look with the others appliances but my OCD is being a problem here haha Before I hit the buy it button I would like some honest advices about mixing appliances brands! Thanks,5,48,1759007227.0,https://www.reddit.com/r/Appliances/comments/1ns6daa/do_you_have_mixed_appliances_brands/,https://reddit.com/r/Appliances/comments/1ns6daa/do_you_have_mixed_appliances_brands/,['advice'],['dishwasher']
