subreddit,title,selftext,score,num_comments,created_utc,url,permalink,demand_signals,matched_keywords
Appliances,"Bought a brand new dishwasher from Lowes, there was moisture inside and water came out of the drain hose..is that normal?","Bought a brand new dishwasher from Lowes and got it home, out of the box and in the house and I noticed when I opened the door it was a little moist inside, then I went to grab the drain hose and it poured about a half cup of water on my floor. Is that normal or did I get a potentially used/returned dishwasher? ",4,21,1758476793.0,https://www.reddit.com/r/Appliances/comments/1nmyhfl/bought_a_brand_new_dishwasher_from_lowes_there/,https://reddit.com/r/Appliances/comments/1nmyhfl/bought_a_brand_new_dishwasher_from_lowes_there/,[],['dishwasher']
appliancerepair,Wife put a mug of bacon grease in the dishwasher,"My wife somehow failed to notice that I had filled a coffee mug ~1/2 full with bacon grease, which had solidified, and put it in the dishwasher and ran a cycle. Everything obviously came out covered in grease so we ran again and the dishes seem fine, but I’m worried about long-term effects to the drain/pump/pipes. Anyone have any experience with something like this?",12,42,1758665316.0,https://www.reddit.com/r/appliancerepair/comments/1nouzeo/wife_put_a_mug_of_bacon_grease_in_the_dishwasher/,https://reddit.com/r/appliancerepair/comments/1nouzeo/wife_put_a_mug_of_bacon_grease_in_the_dishwasher/,['failed'],['dishwasher']
appliancerepair,My Frigidaire appliances have been running well for almost 20 years,"I know this is not a usual post but when I moved in the house I bought all Frigidaire Professional appliances for the kitchen (barely used at a dentist's office) and washer/dryer. Since then everything is still running with some maintenance. The microwave just needed a little liquid nails to keep the front by the vents on. The dishwasher hasn't needed anything and is used multiple times weekly. The fridge got a surge once 10 years ago and needed a new fan and capacitor. It's still going strong, ",10,11,1758463805.0,https://www.reddit.com/r/appliancerepair/comments/1nmsywq/my_frigidaire_appliances_have_been_running_well/,https://reddit.com/r/appliancerepair/comments/1nmsywq/my_frigidaire_appliances_have_been_running_well/,[],"['dishwasher', 'washing machine', 'dryer', 'microwave']"
appliancerepair,"Dishwasher: Can you tell me what part is leaking in this video, and direct me to the needed info to replace it? I don’t know shit but I’m willing to try",https://youtu.be/nBLgWXvPpMk?si=u8r_14WRvZ8YkmMv,5,12,1758749599.0,https://www.reddit.com/r/appliancerepair/comments/1npoq82/dishwasher_can_you_tell_me_what_part_is_leaking/,https://reddit.com/r/appliancerepair/comments/1npoq82/dishwasher_can_you_tell_me_what_part_is_leaking/,[],['dishwasher']
appliancerepair,Top freezer refrigerator with big temp swings in freezer,"Hi folks, I have Maytag MRT118FFFE top freezer fridge in my garage that's about 7 years old. Earlier this year I noticed everything was partly melted so I got a temperature sensor that logs data and can see that the freezer cools down to 0 and then immediately starts cooling back up to 20-30F and keeps repeating this cycle. The refrigerator section is fine, it says at a consistent 38F all the time (I also have a temp sensor there).

We just stopped using the freezer section since we have a chest",3,2,1758998188.0,https://i.redd.it/ihno1pzy1rrf1.jpeg,https://reddit.com/r/appliancerepair/comments/1ns2qfe/top_freezer_refrigerator_with_big_temp_swings_in/,['stopped'],['refrigerator']
appliancerepair,Should my dryer exhaust vent have this wire cover?,"I’m having to climb on the roof every couple of weeks to clean it out because I’m getting flow error messages on my LG dryer. Inside the vent there’s the flap that opens when the dryer is running. Can I just remove the metal wire cover for good?

https://imgur.com/a/VZw0vna
",3,19,1758845958.0,https://www.reddit.com/r/appliancerepair/comments/1nqn30y/should_my_dryer_exhaust_vent_have_this_wire_cover/,https://reddit.com/r/appliancerepair/comments/1nqn30y/should_my_dryer_exhaust_vent_have_this_wire_cover/,[],['dryer']
appliancerepair,Need Help finding the right dryer belt,"Hi everyone!
The belt in my old Kenmore dryer snapped recently. I was able to disassemble the dryer using YouTube and found the snapped belt inside. 
I’m having trouble finding the model number of the dryer, it looks like the stickers have completely faded/worn off. 
If anyone can lead me in the right direction I’d really appreciate it! I have posted photos on my profile since I can’t post any here",3,5,1758580417.0,https://www.reddit.com/r/appliancerepair/comments/1no0q2o/need_help_finding_the_right_dryer_belt/,https://reddit.com/r/appliancerepair/comments/1no0q2o/need_help_finding_the_right_dryer_belt/,"['need help', 'having trouble']",['dryer']
appliancerepair,LG DLGX3901W thermal fuse tripping,"My LG DLGX3901W gas dryer keeps tripping the thermal fuse in the vent section.  I have tried replacing the fuse, followed by the fuse in combination with the thermistor and the high-limit thermostat in the heating section.  The thermistor did not appear to be bad at room temp, according to measurement with a multimeter.

The dryer is 5 years old and I have also replaced the entire vent line, although it had some lint buildup, I do not believe it has ever been significantly obstructed.  I cleaned",2,9,1758843995.0,https://www.reddit.com/r/appliancerepair/comments/1nqmdxs/lg_dlgx3901w_thermal_fuse_tripping/,https://reddit.com/r/appliancerepair/comments/1nqmdxs/lg_dlgx3901w_thermal_fuse_tripping/,[],['dryer']
appliancerepair,"Bosch vision dryer won't start, no error displayed.","I have a Bosch vision 500 tumble dryer I just moved houses with. I had to remove the front panel to fit it around a tight corner.

serial wtvc5330us / 09

The dryer no longer runs.

It powers on, I select a cycle and hit play. I hear at least one relay click, the light inside turns on for a minute and then shuts off. It does not seem to attempt to spin.

It never spins.

I can manually spin the drum in both directions with gentle resistance.

I sort of suspect the wiring for the door lock/sensor",2,4,1758838635.0,https://www.reddit.com/r/appliancerepair/comments/1nqkd7n/bosch_vision_dryer_wont_start_no_error_displayed/,https://reddit.com/r/appliancerepair/comments/1nqkd7n/bosch_vision_dryer_wont_start_no_error_displayed/,"['advice', 'advice']",['dryer']
appliancerepair,My fridge is not cold,"So as it says in the title, my fridge often doesnt get cold. The temperature is currently reading 60 degrees. 
We have been in this apartment for 5 years and this is the third refrigerator we've had. They all had the same problem. Our freezer is fine.  Sometimes I have to clear off the ice build up toward the back where the vents are but other than that.  We don't have tons of food in either area and I keep everything away from the back of the freezer so that nothing is blocking the vents. 
I ha",2,9,1758817844.0,https://www.reddit.com/r/appliancerepair/comments/1nqbgoz/my_fridge_is_not_cold/,https://reddit.com/r/appliancerepair/comments/1nqbgoz/my_fridge_is_not_cold/,"['recommend', 'recommend', 'apartment']",['refrigerator']
appliancerepair,Cleaning *underneath* washing machine door seal,"Hi everyone! The rubber door seal on my washing machine was super moldy so, rather than clean it, I used a YouTube tutorial to yank it out and ordered a new one. 

Problem is, there is a ton of mold and gunk underneath where the door seal once was, and I can't reach those areas. I think it has to be disassembled to be cleaned, but I can't find anyone to help, including the manufacturer. 

Any advice? My only thought is that maybe I can run the ""clean machine"" cycle to clean that area, but withou",2,7,1758729166.0,https://www.reddit.com/r/appliancerepair/comments/1npfuio/cleaning_underneath_washing_machine_door_seal/,https://reddit.com/r/appliancerepair/comments/1npfuio/cleaning_underneath_washing_machine_door_seal/,"['tutorial', 'advice', 'tutorial']",['washing machine']
appliancerepair,Kenmore oven fails occasionally after it heats up. Only way to fix it is to slam the door over and over until the time comes back,"Sometimes Ill get lucky and be able to cook something all the way through, but more often than not Ill have to do the “door slamming thing” at least once.

It doesnt show a code, just part of the time. For example in my video (comments) the time is 12:24 and it shows the first and third digit 1_2 until I slam it enough times to bring the whole time back. Once that happens I can set the temp again. ",2,6,1758601927.0,https://www.reddit.com/r/appliancerepair/comments/1no83vl/kenmore_oven_fails_occasionally_after_it_heats_up/,https://reddit.com/r/appliancerepair/comments/1no83vl/kenmore_oven_fails_occasionally_after_it_heats_up/,[],['oven']
appliancerepair,Can you convert Dishwasher from hardline to plug-in,I have a a dishwasher that currently has hardline power supply. Can I convert it or any other dishwasher to a plug-in power supply.,2,6,1758469806.0,https://www.reddit.com/r/appliancerepair/comments/1nmvhgw/can_you_convert_dishwasher_from_hardline_to_plugin/,https://reddit.com/r/appliancerepair/comments/1nmvhgw/can_you_convert_dishwasher_from_hardline_to_plugin/,[],['dishwasher']
appliancerepair,Help,So I didn’t catching unbalanced low in time and it finished the cycle all the way through now my washing machine won’t start the wash cycle. What should I do? Is it the speed sensor?,2,5,1758425491.0,https://www.reddit.com/r/appliancerepair/comments/1nmhluk/help/,https://reddit.com/r/appliancerepair/comments/1nmhluk/help/,[],['washing machine']
appliancerepair,"LG front load washer, drain pump hose clogged","This is an LG front loader. I regularly clean out the filter in the little door on the bottom left. I noticed that water never comes out of the little drain hose. I just stuck a long skewer into it, and it's totally clogged with what feels like sand. I got some out with the longest drill bit I have, but it's still clogged. I can feel it if I squeeze the hose. It's very firm past a few inches. 

Is it actually necessary for this hose to be open, or does the water that drains when I unscrew the fi",1,1,1758996879.0,https://www.reddit.com/r/appliancerepair/comments/1ns271w/lg_front_load_washer_drain_pump_hose_clogged/,https://reddit.com/r/appliancerepair/comments/1ns271w/lg_front_load_washer_drain_pump_hose_clogged/,['advice'],['drill']
appliancerepair,Whirlpool gas oven won’t turn OFF. What to do?,"I was baking and for an unrelated reason the electrical breaker this whirlpool gas range and gas oven is part of tripped.

My bake was over so after I reset the breaker I didn’t restart the oven. It was all off.

But then I walked by a few minutes later and the thing is hotter than hell and there’s an error message saying over temp.

I unplugged it but it’s still running gas and hot! Even unpowered.

So I turned off the gas. Unplugged it. And waited ten minutes. Turned it back on, turned on gas,",1,11,1758993052.0,https://i.redd.it/l926uybfpqrf1.jpeg,https://reddit.com/r/appliancerepair/comments/1ns0l80/whirlpool_gas_oven_wont_turn_off_what_to_do/,[],['oven']
appliancerepair,Samsung washing machine ends cycles early (HE) error,"I have a Samsung wf42h5000aw/a2 that started acting up a few days ago. It terminates the spin cycle early with an ""HE"" error. I have no experience fixing washing machines, I'd appreciate if someone can point me in the right direction before I start sinking $ into it. ",1,6,1758992150.0,https://v.redd.it/213zs0uskqrf1,https://reddit.com/r/appliancerepair/comments/1ns07s7/samsung_washing_machine_ends_cycles_early_he_error/,[],['washing machine']
appliancerepair,How to temporary bypass Kitchenaid dishwasher (model KDTE104ESS3) to check circulation,"I have a KitchenAid Dishwasher (Model KDTE104ESS3) that doesn't seem to be cleaning well.  I've tried all of the standard things like cleaning, changing detergents, etc.  The next step is to determine if the circulation pump is working properly.  To do that I need to **temporarily** bypass the door switch.  I want to do this so that I am able to check the water pressure while it is running.  

I can't find out how to do the bypass online.  What is the best way to do the bypass?

Thank your for y",1,2,1758989012.0,https://www.reddit.com/r/appliancerepair/comments/1nryxkn/how_to_temporary_bypass_kitchenaid_dishwasher/,https://reddit.com/r/appliancerepair/comments/1nryxkn/how_to_temporary_bypass_kitchenaid_dishwasher/,"['how to', 'how to']",['dishwasher']
appliancerepair,Issue with washing machine not draining,"Model is Kenmore 500 series. 

I put a large load of sheets in and selected super load and heavy wash settings. Everything seemed normal until the sound stopped and I opened the lid and it was full of water and just stopped. I turned the dial back to start and it started again. And then stopped when full of water. We did that multiple times- it starts on any setting (normal, delicates, heavy) but it doesn't drain the water. It doesn't add any more water, thankfully. 

I removed all the sheets, s",1,0,1758987631.0,https://www.reddit.com/r/appliancerepair/comments/1nrydhe/issue_with_washing_machine_not_draining/,https://reddit.com/r/appliancerepair/comments/1nrydhe/issue_with_washing_machine_not_draining/,"['stopped', 'stopped', 'stopped']",['washing machine']
appliancerepair,Frigidaire dishwasher no water,"FGID2466QF6A for reference.

Went to start a load of dishes the other day and after a couple minutes it didn’t quite sound right, popped it open and sure enough it wasn’t getting any water. Immediately started tearing into it and this is what I’ve checked so far.

Water to dishwasher is on.

Disconnected water line right before fill valve and getting good pressure there.

Ohm’d out the fill valve and it was good.

Getting 120v at the fill valve plug.

Overflow sensor has continuity and is workin",1,0,1758987472.0,https://www.reddit.com/r/appliancerepair/comments/1nryb53/frigidaire_dishwasher_no_water/,https://reddit.com/r/appliancerepair/comments/1nryb53/frigidaire_dishwasher_no_water/,['recommend'],['dishwasher']
appliancerepair,Dishwasher cleans some dishes but not all,Hi all! Recently (like the last 5 washes) our dishwasher is not getting all the dishes clean. Sometimes a plate or bowl will have a residual residue on it or silverware will have residual food. Most things are clean but 3-5 items have to be rewashed by hand. Any ideas what could be wrong or how to fix this? I already cleaned the filter and no change. It also won’t release the drying agent. Not sure if that’s related or separate. It is a whirlpool. Thanks! ,1,4,1758983034.0,https://www.reddit.com/r/appliancerepair/comments/1nrwjge/dishwasher_cleans_some_dishes_but_not_all/,https://reddit.com/r/appliancerepair/comments/1nrwjge/dishwasher_cleans_some_dishes_but_not_all/,['how to'],['dishwasher']
appliancerepair,Samsung Dryer sounds like a machine gun,"Its only started about 2 weeks ago, but our dryer sounds like a machine gun, or a jackhammer, even with almost nothing in it. 

Any ideas what part it could be? ",1,47,1758975951.0,https://www.reddit.com/r/appliancerepair/comments/1nrtxbg/samsung_dryer_sounds_like_a_machine_gun/,https://reddit.com/r/appliancerepair/comments/1nrtxbg/samsung_dryer_sounds_like_a_machine_gun/,[],['dryer']
appliancerepair,Desperately need help with whirlpool front load dryer,"

I have a whirlpool front loading dryer. Initially it wouldn't start it would just make a clicking noise. I got it to show me error codes F4E4 F4E3 F2E1. Underneath CCU I did find a burn mark in what looked like a melted component. Installed the New CCU used a voltage meter and confirmed AC and DC per manufacturers instructions. When I turn the dryer on,  I get F6 E2 and two beeps.  

After messing with diagnostic and installation mode, somehow I got the machine to give me these codes, but can'",1,22,1758946064.0,https://v.redd.it/8c9tuzfmtmrf1,https://reddit.com/r/appliancerepair/comments/1nrlp94/desperately_need_help_with_whirlpool_front_load/,"['help with', 'need help']",['dryer']
appliancerepair,Dishwasher leak AFTER spray arm replacement,"Short version: damaged my lower spray arm, replaced it and now my dishwasher is leaking at the bottom corners

Details: Whirlpool (WDT970SAHZ0) dishwasher with new lower spray arm part W10837249. 

I melted my old one after I forgot to reinstall it while cleaning. The install of the new one seemed simple enough, but can’t for the life of me figure out why it’s leaking now. Opening the door during the cycle I can see the arm is spraying and spinning

Searched and searched and can’t come up with a",1,13,1758929692.0,https://www.reddit.com/r/appliancerepair/comments/1nrgd7r/dishwasher_leak_after_spray_arm_replacement/,https://reddit.com/r/appliancerepair/comments/1nrgd7r/dishwasher_leak_after_spray_arm_replacement/,[],['dishwasher']
Frugal,How do you all use your food vacuum sealer?,"I’ve been debating whether a food vacuum sealer is really worth the investment and wanted to hear from people here who try to be frugal. Do you find it saves you money in the long run, or does it end up being another gadget that collects dust? I’m mostly thinking about freezing meats, bulk foods, and leftovers, but I’d love to know the specific ways you all use yours. Are there creative or unexpected uses I should know about? Also, do you have advice on bag costs, maintenance, or brands that giv",61,240,1758654422.0,https://www.reddit.com/r/Frugal/comments/1noqb6m/how_do_you_all_use_your_food_vacuum_sealer/,https://reddit.com/r/Frugal/comments/1noqb6m/how_do_you_all_use_your_food_vacuum_sealer/,['advice'],['vacuum']
Frugal,It’s time for a new mattress. What did you get?,"I’ve finally hit the point where I need to upgrade my mattress. For the past 3 years I’ve been sleeping on a $180 Walmart special, and let me just say… my back is wrecked. 🫶🏼 It’s sagging, it doesn’t have any real support, and I wake up stiff and sore more often than not. I’ve held off for way too long because mattresses feel like such a huge purchase, but I think I’m ready to invest in something decent this time.

What I’m looking for:
	•	Size: Queen
	•	Feel: Extra firm (I really prefer sleepin",57,142,1758762032.0,https://www.reddit.com/r/Frugal/comments/1nptd6i/its_time_for_a_new_mattress_what_did_you_get/,https://reddit.com/r/Frugal/comments/1nptd6i/its_time_for_a_new_mattress_what_did_you_get/,"['recommend', 'budget', 'budget', 'budget']",['oven']
BudgetFood,"Easy Chicken Parm, pasta and a vegetable","Made this meal in 30 minutes with shortcuts.  

Used store brand chicken patties.  Follow package instructions for baking but these were done in 425 deg F oven for 18 minutes flipping half way.  Add a slice of provolone or cheese of choice after flipping.  Cheese will get golden brown and will get some crust at base of patties.

Sauce was crushed tomatoes with basil (28 oz can) and herbs, dried minced garlic and onion from pantry, salt, pepper, crushed red pepper and honey.  Also added a little ",203,10,1758923041.0,https://www.reddit.com/gallery/1nrdwcg,https://reddit.com/r/budgetfood/comments/1nrdwcg/easy_chicken_parm_pasta_and_a_vegetable/,"['recommend', 'cheap', 'alternative']",['oven']
BudgetFood,Carrot ginger soup with red lentils cost me approximately $2 CAD in ingredients to make.,"(I just deleted the initial post as I forgot to mention to purée it, which I just fixed down below)

I was searching the internet for a way to use red lentils and I came upon a recipe on “hey nutritional lady”.  It’s supposed to be vegan but I used chicken stock powder, as that’s what I had in my cupboard. 

They offered different instructions for various cooking vessels.  I chose to do it in my instant pot but I tweaked how to cook it versus their dump and start. 

Ingredients 
* 1 tablespoon e",62,17,1759007491.0,https://i.redd.it/y6er2pedwrrf1.jpeg,https://reddit.com/r/budgetfood/comments/1ns6h49/carrot_ginger_soup_with_red_lentils_cost_me/,['how to'],"['instant pot', 'blender']"
MealPrepSunday,Last nights meal prep,"I have an edited video on my meal prep IG if you guys want to check it out 

- @we_got_food_at_home_boo on Instagram

Couple of things - I’ve gotten a lot of questions about my prep that I want to address on this post 

1. Burritos are kept in the freezer. Everything else that I prepare in the containers are kept in the fridge.
2. My meals last from Monday through Friday, and I do not notice any problems with quality by the end of the week.
3. I don’t get tired of the same food everyday. I chang",661,19,1758543608.0,https://www.reddit.com/gallery/1nnkxag,https://reddit.com/r/MealPrepSunday/comments/1nnkxag/last_nights_meal_prep/,['how to'],['oven']
MealPrepSunday,this week’s meal prep,"3 boxes (breakfast, lunch and snack are mine), 4 boxes (breakfast and 3 lunches) for husband

1st photo:

breakfasts:

* egg muffins (180• for 15minutes in the oven) with spinach, onion and mushrooms (veggies on the side)

* omelette with peppers

snacks: fruits (apples, strawberries, blueberries amd kiwi)

lunches:

* fried chicken with potatoes and veggies (cauliflower and broccoli)

* pasta with tuna (pasta, tuna, canned tomatoes, sweetcorn and corriander)

* chicken with rice + mix of veggie",593,35,1758871518.0,https://www.reddit.com/gallery/1nquxp5,https://reddit.com/r/MealPrepSunday/comments/1nquxp5/this_weeks_meal_prep/,[],['oven']
MealPrepSunday,Happy Meal Prep Sunday!!,"It’s that time of the week! Meal prep dayyyy :)

I’ve decided to split my meal prep days in half due to my current work schedule. Sunday I cook 2 meals and Tuesday I’ll cook 2 more meals. I work 3 12s a week so it just makes sense to split up the cooking on my 4 off days to keep things as fresh as possible.

Here’s what I prepared for my husband and I in my first prep of the week:

**Cajun Chicken Alfredo w/ Roasted Parmesan Broccoli**

- 20 oz chicken breast

- 8 oz fettuccine noodles

- 15 oz ",288,26,1758448784.0,https://www.reddit.com/gallery/1nmo12l,https://reddit.com/r/MealPrepSunday/comments/1nmo12l/happy_meal_prep_sunday/,[],"['air fryer', 'blender']"
MealPrepSunday,"Sloppy Joe Hot Dish, Beef and Veggie Skillet Meal, Cajun Shrimp Alfredo, and Chocolate-Pistachio Yogurt Pudding","Something that I've been doing for a while now for several aspects of my life is a technique that I call harvesting motivation.  That simply means that when I'm motivated, I do things to set future me up for success.  In the context of meal prepping that means that I have a calendar with meal prep ideas planned out until about June, along with about a month's worth of step-by-step instructions to optimize my prep time.  It's not written in stone.  I can, and do, swap out meals on occassion, but ",101,8,1758481306.0,https://www.reddit.com/gallery/1nn0h67,https://reddit.com/r/MealPrepSunday/comments/1nn0h67/sloppy_joe_hot_dish_beef_and_veggie_skillet_meal/,[],"['oven', 'air fryer']"
MealPrepSunday,Korean Braised Pork w/ Rice,"• 1.5kg pork shoulder roast
• 1 very large carrot
• 1 large onion
• 4-5 shallots
• 1 bunch green onion
• 1"" knob of ginger
• 6-7 garlic cloves
• 2 tomatoes 

Braising Liquid:
• 2 cups chicken stock
• 1 tbsp gochugang 
• 1 tbsp oyster sauce
• 1.5 tsp light soy sauce
• 1.5 tsp dark soy sauce
• 1.5 tsp fish sauce
• 2 tbsp sugar
• 1 tsp sesame oil
• 1 tsp white pepper
• 1 tbsp rice vinegar 
• pinch MSG 

Heavily season pork with salt and pepper then sear well on all sides in a large pot. When all si",95,5,1758652775.0,https://www.reddit.com/gallery/1nopkq5,https://reddit.com/r/MealPrepSunday/comments/1nopkq5/korean_braised_pork_w_rice/,[],['oven']
MealPrepSunday,More Meals For This Week :),"Hello & happy Tuesday!

Here are some more meals I made for my husband and I for this week. I asked him what he wanted and he said “hamburger helper,” so yes, that is one of our meals this week 😂 bonus pics of the process at the end!

**Chicken Souvlaki Pitas & Veggies**

- 20 oz chicken breast, marinated

- 1 large or 2 small zucchinis

- 2 bell peppers

- Pitas & tzatziki sauce (not pictured)

- Chicken marinade: 1/4 cup olive oil, 1/8 cup lemon juice, 1 tsp dried oregano, 1 tsp salt, 1 tsp pe",90,14,1758604091.0,https://www.reddit.com/gallery/1no8qhx,https://reddit.com/r/MealPrepSunday/comments/1no8qhx/more_meals_for_this_week/,[],['microwave']
MealPrepSunday,Lost flavor when cooling?,"I have been trying some new recipes and I am having this issue that the meal tastes good while it’s hot but then the next day it seems like all the flavors are gone. This happened to me twice. 

The first time I made like ground beef in some packet gravy then poured it over potatoes and veggies, the meat tasted nice and flavorful when it was hot then once reheated it was pretty flavorless. 

This time I made chicken in a chipotle vinegar sauce (spicy and strong sauce) and then mixed the chicken ",41,12,1758579315.0,https://i.redd.it/eqipl5q6jsqf1.jpeg,https://reddit.com/r/MealPrepSunday/comments/1no0aw0/lost_flavor_when_cooling/,"['first time', 'beginner']",['dryer']
