subreddit,title,selftext,score,num_comments,created_utc,url,permalink,demand_signals,matched_keywords
Tools,Is this a normal amount of oil from an oil-lubricated air compressor?,"I've just bought a new compressor and oil is coming through the duster. 

My current setup is:

Compressor > inline filter ---10m---> filter/regulator ---10m coil---> blower (running at 2 bar).

  
It seems like a lot, especially since the blower will be my main tool of use. What does everyone think? and how much oil should I be getting?",1289,189,1758753026.0,https://v.redd.it/jjg22h4cv6rf1,https://reddit.com/r/Tools/comments/1npq3xr/is_this_a_normal_amount_of_oil_from_an/,[],['air compressor']
Tools,Funny moment that made me appreciate my tools more,"The other night I was sitting on my couch half distracted on myprize, when I glanced over at my little tool rack. It hit me how much easier life has gotten just from slowly building up a decent set. A couple years ago I didn’t even own a drill and every small repair felt like a massive headache. Now I’ve got a handful of solid basics a drill, socket set, level, and a few other essentials and it’s wild how much stress they’ve saved me. Instead of putting things off or improvising with the wrong s",250,55,1758713628.0,https://www.reddit.com/r/Tools/comments/1np9p8n/funny_moment_that_made_me_appreciate_my_tools_more/,https://reddit.com/r/Tools/comments/1np9p8n/funny_moment_that_made_me_appreciate_my_tools_more/,[],['drill']
Tools,Finally upgraded my drill after years of using a hand me down,"I’ve been using my dad’s old corded drill for years. It still technically works, but the chuck slips and the cord is all frayed. I finally had some extra money saved from a win on rollingriches and grabbed a Milwaukee cordless set this week. Honestly, it feels like night and day lighter, faster, and no extension cords everywhere. I spent half the afternoon just finding excuses to use it.",198,33,1758631368.0,https://www.reddit.com/r/Tools/comments/1nogcch/finally_upgraded_my_drill_after_years_of_using_a/,https://reddit.com/r/Tools/comments/1nogcch/finally_upgraded_my_drill_after_years_of_using_a/,[],"['drill', 'cordless', 'chuck']"
Tools,Tips to remove this hellacious hex bolt? (Switching saw blades),"I'm struggling to remove the saw blade on my new, pretty cheap Metabo HPT miter saw. It's been a multiple-day ordeal, and even using a hammer on the hex bar hasn't helped at all (that was a last resort). 

This is left-hand threaded, so it turns clockwise to remove. I'm turning it in the right direction. 

Thanks!",179,200,1758571186.0,https://www.reddit.com/gallery/1nnwv8r,https://reddit.com/r/Tools/comments/1nnwv8r/tips_to_remove_this_hellacious_hex_bolt_switching/,['cheap'],"['miter saw', 'blade']"
Tools,Any ideas on how I can get this stripped screw out without damaging this terminal block?,"Tried all sizes of my speed out and now it looks like a rivet, it’s super small to get some pliers in there and getting this terminal block is not easy on my dryer so want to keep it in tact as much as possible, appreciate any ideas!",169,175,1758807851.0,https://www.reddit.com/gallery/1nq75xc,https://reddit.com/r/Tools/comments/1nq75xc/any_ideas_on_how_i_can_get_this_stripped_screw/,[],['dryer']
Dewalt,two separate batteries. two separate chargers. pretty much brand new. two different circuts. 15 amp flexvolts,"bought these guys and had them sitting on the charger over night in the shed. had the window open, woke up to that sweet smell of lithium this morning. these are the dcb615s, I contacted dewalt and they told me I have to ship them at my expense to a service center to determine if I'm able to recieve replacements or not. pretty sure that even my dumbest ideas can't top how dumb it is to ship fried 15 amp lithium batteries through the mail. 

So no, I'm not shipping them out. not really sure what ",484,105,1758580336.0,https://i.redd.it/elaugn08msqf1.jpeg,https://reddit.com/r/Dewalt/comments/1no0ozo/two_separate_batteries_two_separate_chargers/,[],['miter saw']
Dewalt,NTD,Finally got my fan (battery not included). I've been looking at it for a while now and decided to get it after working alot of hours after starting a new job.,204,76,1758484730.0,https://i.redd.it/e2im08nxpkqf1.jpeg,https://reddit.com/r/Dewalt/comments/1nn1yko/ntd/,[],['battery']
Dewalt,Really liking the new Powerpack 4ah batteries,"I've been using them for the last month of so. I'm really impressed with them so far. Tools feel like they get a nice bump in power, compared to other small batteries and even the 5ah. These are my go to for mini cutoff, die grinder, bandfile, stick vacuum, mini blower, drill. 
 I liked the form factor of the 4ah compact, but they continually failed on me. Most unreliable battery I've had. These tabless cells are said to be very durable. If that proves true, these are winners. I think they run d",114,49,1758612866.0,https://i.redd.it/7yxevxxxavqf1.jpeg,https://reddit.com/r/Dewalt/comments/1nob2zo/really_liking_the_new_powerpack_4ah_batteries/,['failed'],"['drill', 'battery', 'vacuum']"
Dewalt,NTD. My first “grown up” angle grinder,"I was planning to buy angle grinder for quite some time now. Never had one (except some corded generic Chinese stuff I was borrowing for couple of times). I don’t necessearly need one all the time but this is a very useful tool and sometimes you just need one from a capital N. 
So I decided to go with flexvolt DCG418 since I have a couple of flexvolt batteries. Kinda on the heavy side but damn this thing is powerful. 

How did I do? Is it any good in the long run? 
 
For now I’m very happy with ",108,31,1758810131.0,https://i.redd.it/n31cu7bhjbrf1.jpeg,https://reddit.com/r/Dewalt/comments/1nq83zx/ntd_my_first_grown_up_angle_grinder/,[],['angle grinder']
Dewalt,Battery death in 1 to 2 years normal?,Battery on the top is the only one that holds a charge. The bottom big one is 1 year old and the two small on the bottom are 2 years old. Only the top one still holds a charge. Am I missing something? Seems terrible battery quality but I love the auger drill tool that I use these for ,95,90,1758668007.0,https://i.redd.it/gzdz83svuzqf1.jpeg,https://reddit.com/r/Dewalt/comments/1now1aw/battery_death_in_1_to_2_years_normal/,[],"['drill', 'battery']"
Dewalt,What's the difference between this battery and the ones not xr,They're both DCB205. ,77,63,1758589823.0,https://i.redd.it/7lpvpwifetqf1.png,https://reddit.com/r/Dewalt/comments/1no4472/whats_the_difference_between_this_battery_and_the/,[],['battery']
Dewalt,DCD1007 w/ 8ah PP & fast-charger for $199,"https://www.theisens.com/products/dewalt-20v-max-xr-brushless-cordless-12-3speed-hammer-drill-kit-with-xr-powerpack

I haven’t purchased from them personally, but they seem legit & this is a great price. I paid $229.99 for this kit Labor Day from Bomgaars & this makes me wish I would’ve waited! ",59,43,1758887129.0,https://www.reddit.com/gallery/1nqz5d0,https://reddit.com/r/Dewalt/comments/1nqz5d0/dcd1007_w_8ah_pp_fastcharger_for_199/,[],"['drill', 'cordless', 'brushless']"
Dewalt,They got me twice in 48 hours,"The DCD800 combo kit deal today at Lowe’s was too good to pass up, and similarly fell for their trap 2 days ago for the right angle drill.

https://www.lowes.com/pd/DEWALT-XR-20-volt-Max-1-2-in-Brushless-Cordless-Drill-2-Batteries-Included-Soft-Bag-included/5013277523

",57,44,1758806238.0,https://www.reddit.com/gallery/1nq6in8,https://reddit.com/r/Dewalt/comments/1nq6in8/they_got_me_twice_in_48_hours/,[],"['drill', 'cordless', 'brushless']"
Dewalt,How's the cordless screwdriver- DWHT66719?,"How do you guys like it?

I change a lot of lightbulbs, door batteries and other small jobs I'd want this for. I would not be using it for anchoring anything to walls, into wood, or anything heavy duty. 

Any idea why ace has it $30 more expensive than HD or lowes?",39,50,1758820004.0,https://i.redd.it/wfnep0ivecrf1.jpeg,https://reddit.com/r/Dewalt/comments/1nqcesd/hows_the_cordless_screwdriver_dwht66719/,['expensive'],['cordless']
Dewalt,Good luck! available for shipping!,https://www.atwoods.com/tools--hardware/power-tools/impact-wrenches/dewalt-12-in-20v-max-lithium-ion-cordless-impact-wrench-bare-tool/,29,21,1758662994.0,https://www.reddit.com/r/Dewalt/comments/1nou0yb/good_luck_available_for_shipping/,https://reddit.com/r/Dewalt/comments/1nou0yb/good_luck_available_for_shipping/,[],['cordless']
Dewalt,Tools with free battery. Will deal work?,,24,15,1758680293.0,https://i.redd.it/1tkxbn0gv0rf1.jpeg,https://reddit.com/r/Dewalt/comments/1np0fa2/tools_with_free_battery_will_deal_work/,[],['battery']
Dewalt,NTD $239 + Free 5AH battery,,26,10,1758827339.0,https://i.redd.it/0eq615po0drf1.jpeg,https://reddit.com/r/Dewalt/comments/1nqfmmk/ntd_239_free_5ah_battery/,[],['battery']
Dewalt,Dcd800 w/ batteries only $99,https://www.lowes.com/pd/DEWALT-XR-20-volt-Max-1-2-in-Brushless-Cordless-Drill-2-Batteries-Included-Soft-Bag-included/5013277523?idProductFound=false&idExtracted=true,25,7,1758784113.0,https://www.reddit.com/r/Dewalt/comments/1nq0322/dcd800_w_batteries_only_99/,https://reddit.com/r/Dewalt/comments/1nq0322/dcd800_w_batteries_only_99/,[],"['drill', 'cordless', 'brushless']"
Dewalt,NTD - $122 891B impact wrench using price matching,"Nice purchase here using price matching across home Depot and Lowe's. They have the same BOGO deals on DeWalt, but Lowe's values the battery at $169 while home Depot at $119. You can get the tool for less if they price match the tool and don't change/match the value of the battery. ",23,9,1758645599.0,https://www.reddit.com/gallery/1nome63,https://reddit.com/r/Dewalt/comments/1nome63/ntd_122_891b_impact_wrench_using_price_matching/,[],['battery']
Dewalt,Dewalt DCW600b 20v Compact Trim Router,"Why did I wait so long to get one of these things? So much handier than my big DW618 full size corded router, just makes quickly grabbing a router and throwing a round over or chamfer on easy.

Anyway, just thought I'd share :) do love my Dewalt tools and this one is no exception!",18,20,1758760120.0,https://youtu.be/9yefTuTKkTs,https://reddit.com/r/Dewalt/comments/1npsp9g/dewalt_dcw600b_20v_compact_trim_router/,[],['router']
Dewalt,Does anyone use a hammer drill as their daily/main drill?,I want to upgrade from a dcd777 and could benefit from having the hammer option. I'm looking at the dcd806 which is currently $147 on Amazon. Would this be a good daily use option or would you suggest something different? Just want to be able to do lighter masonry drilling for anchors or in stucco when needed and have a solid more powerful main use drill. And is $147 a fair price for tool only? ,19,74,1758897653.0,https://www.reddit.com/r/Dewalt/comments/1nr34y9/does_anyone_use_a_hammer_drill_as_their_dailymain/,https://reddit.com/r/Dewalt/comments/1nr34y9/does_anyone_use_a_hammer_drill_as_their_dailymain/,[],['drill']
Dewalt,Is this amount of play normal? DWE7491,"DWE7491 had a worn out spindle assembly that caused the arbor nut to come loose (bought used). Reached out to Dewalt and they sent me a new assembly to put in myself, which I did… a few weeks after taking it apart. Now I’ve got two extra screws and a blade that has a bit of play. The answer seems obvious, but I can’t find a home for these two screws, or a way to fix this amount of play. The majority of the play comes from the splitter, and does not seem to effect the blade while cutting, althoug",20,12,1758474130.0,https://v.redd.it/4fjeggxeujqf1,https://reddit.com/r/Dewalt/comments/1nmxc37/is_this_amount_of_play_normal_dwe7491/,[],['blade']
Dewalt,No power from power stack,"Charged the battery for about an hour. Battery indicates full charge. 

When I attach my tool and squeeze the trigger, there is a weak sound and less than a quarter turn. Anyone know what is causing this?

Older battery allows tool to work just fine. ",17,8,1758750692.0,https://www.reddit.com/gallery/1npp6f8,https://reddit.com/r/Dewalt/comments/1npp6f8/no_power_from_power_stack/,[],['battery']
Dewalt,Dewalt Portable Vacuums - looking for feedback on the two available models. Does either stand out as better than the other?,"Looking to use for car vehicle, small messes around the apartment. I don’t have space to store a big shop vac at this point.",16,75,1758474289.0,https://www.reddit.com/gallery/1nmxek6,https://reddit.com/r/Dewalt/comments/1nmxek6/dewalt_portable_vacuums_looking_for_feedback_on/,['apartment'],['vacuum']
Dewalt,Deal on the 1007 and 8ah,https://www.theisens.com/products/dewalt-20v-max-xr-brushless-cordless-12-3speed-hammer-drill-kit-with-xr-powerpack,14,19,1758911141.0,https://i.redd.it/3gqsbjbvxjrf1.jpeg,https://reddit.com/r/Dewalt/comments/1nr8y4n/deal_on_the_1007_and_8ah/,[],"['drill', 'cordless', 'brushless']"
Dewalt,"Can someone help me, please?","Tried to jump my car, like I did before and it didn’t work. When I looked things up, it said it should at least 12.4, but this says 11. It’s charging right now. Should I let it charge to 12 (it’s going very slow now that it’s at 11.4). And try again, or is it, or my car battery cooked? It was making a clicking noise when I tried to use it to jump my car. Thanks for the help. ",15,16,1758422950.0,https://i.redd.it/j3zmiwy7mfqf1.jpeg,https://reddit.com/r/Dewalt/comments/1nmgtje/can_someone_help_me_please/,['can someone'],['battery']
Makita,Bought my first Makita tool,"Hello yall, a young and new electrician from Bosnia and Herzegovina, wanted to buy my first tool, and I was thinking Bosch or Makita, ended up buying this beauty. It came out around 220$ for the drill, case, battery and charger. Happy to join the club.",235,41,1758626641.0,https://i.redd.it/kxhd5mowfwqf1.png,https://reddit.com/r/Makita/comments/1noepu1/bought_my_first_makita_tool/,[],"['drill', 'battery']"
Makita,Coworker was using my drill and dropped it from about 4 feet,I assume warranty won’t cover it but is it a replaceable part or is the drill toast ,217,117,1758752384.0,https://i.redd.it/zynj0j2tt6rf1.jpeg,https://reddit.com/r/Makita/comments/1nppuuo/coworker_was_using_my_drill_and_dropped_it_from/,[],['drill']
Makita,From across the pond to the USA. Finally…. 12Ah 18V battery,Big Boi!!!,130,84,1758748607.0,https://www.reddit.com/gallery/1npobio,https://reddit.com/r/Makita/comments/1npobio/from_across_the_pond_to_the_usa_finally_12ah_18v/,[],['battery']
Makita,2030 restoration update!,"Back in april, I bought this 2030 out of a field and decided to do a nuts and bolts restoration. Today I made the first cuts and couldn’t be happier.

Replaced all the cutter head bearings, had the rollers recoated, removed all the rust, repainted, and found a local 9820-2 sharpener for the knives. 

Still need to dial in all the planer geometry, but I had a few beers to celebrate and couldn’t resist sharing. Next step is a Bora mobile base and on to making the trim for our house! ",85,8,1758931668.0,https://www.reddit.com/gallery/1nrh2f2,https://reddit.com/r/Makita/comments/1nrh2f2/2030_restoration_update/,[],['planer']
Makita,I just learned about the LF1000 (flipper saw),"For those unfamiliar, it’s a 10” / 260mm mitre saw (with built-in table) that you can flip over and use as a table saw. I neeeeed. 🤤

But it seems not to be available in the US, despite being available elsewhere for at least a year. From what I saw in a few minutes of Googling, I think it’s Europe only?

For anyone who has one: is it as awesome as it seems?

Come on Makita! Bring the cool stuff to the states!",75,19,1758594402.0,https://www.reddit.com/gallery/1no5pgn,https://reddit.com/r/Makita/comments/1no5pgn/i_just_learned_about_the_lf1000_flipper_saw/,[],['table saw']
Makita,Got the GRH06PM today,"This thing is ginormous. Can't wait to try it. Kind of sad it only comes with 4AH batteries. Feel like a tool this big should be at least 5s. 

Also interesting because there are virtually no videos of this thing being talked about, unboxed, or in use. Using it primarily to drive ground rods in clay, and drill 4 inch and 2-5/8 holes in concrete. ",49,13,1758843783.0,https://www.reddit.com/gallery/1nqmbaq,https://reddit.com/r/Makita/comments/1nqmbaq/got_the_grh06pm_today/,[],['drill']
Makita,Jr003 Cordless Recip saw,,40,23,1758835263.0,https://www.youtube.com/watch?v=AI1xPg2pToY,https://reddit.com/r/Makita/comments/1nqj0ap/jr003_cordless_recip_saw/,[],['cordless']
Makita,"Pawn shop wanted it gone, $5 for the drill. XFD11",,35,36,1758432565.0,https://v.redd.it/u2i0u8etegqf1,https://reddit.com/r/Makita/comments/1nmjol8/pawn_shop_wanted_it_gone_5_for_the_drill_xfd11/,[],['drill']
Makita,Unethical Home Depot Makita battery pack advertising,"Found a great deal for a 2 pack 4 ah with charger for $70 about 2 hours away from me at Home Depot. This was late at night but called first thing in morning to verify inventory of 4 units- was placed on hold and hung up on twice. At that point, I had proceeded to drive to the store as I had to go to work. Upon entering, batteries were not visible anywhere and two reps started looking, even had to ask for help from manager who all gave up after 30 mins search. They apologized and said they would ",30,55,1758477568.0,https://i.redd.it/gw7buizm4kqf1.jpeg,https://reddit.com/r/Makita/comments/1nmytld/unethical_home_depot_makita_battery_pack/,[],['battery']
Makita,Makita MSN001GZ XGT Snow Blower,"Just came across this video where the guy showcases the upcoming 40V snow blower, albeit without snow lol. You should be able to set the audio language to an auto-dubbed English to get most of the info. 

Hopefully this thing rolls out across the world before the winter. It doesn't look super beefy or durable, but the electronic chute control is a nice addition.

The fact that they made this makes me hopeful for an 80v version 2 stage... Even if these battery blowers don't fully replace gas ones",30,15,1758569603.0,https://youtu.be/K2BE__hUcmk?si=FsT4HHDUDF-NME94,https://reddit.com/r/Makita/comments/1nnw6hw/makita_msn001gz_xgt_snow_blower/,[],['battery']
Makita,What's wrong with my reciprocating saw?,I need to wack it to get it to start & then takes a while to get up to full speed.,26,10,1758480278.0,https://v.redd.it/ipxmjc3jckqf1,https://reddit.com/r/Makita/comments/1nn00i3/whats_wrong_with_my_reciprocating_saw/,[],['reciprocating saw']
Makita,Got my tools stolen is this as good of deal as I can get?,"Lost an old school off white impact driver from my girlfriends late father, a sawzall, and the clear/blue vacuum plus 2 batteries.  Just bought a XPH14 hammer drill that I think I can return.  I’m wondering if I should pull the trigger on this or wait for like a Christmas sale or something.  ",26,29,1758535162.0,https://i.redd.it/9mwd5j8wvoqf1.jpeg,https://reddit.com/r/Makita/comments/1nnibgm/got_my_tools_stolen_is_this_as_good_of_deal_as_i/,[],"['drill', 'impact driver', 'vacuum']"
Makita,Made the first step into XGT,"Noticed a couple postings about clearance deals so checked out my local Home Depots (upstate NY). Ended up with the following:

40V max XGT Brushless 15"" String Trimmer Kit (GRU01M1) with 4.0ah Battery and Charger
MSRP: $499; Clearance Price: $250

40V max XGT Brushless Cordless 24"" Hedge Trimmer (GHU02Z, tool only) 
MSRP: $329; Clearance Price: $165

40V max XGT Brushless Cordless Blower Kit (GBU01M1) with 4.0ah Battery and Charger
MSRP: $439; Clearance Price: $220

40V max XGT Brushle",20,13,1758489713.0,https://www.reddit.com/r/Makita/comments/1nn42ui/made_the_first_step_into_xgt/,https://reddit.com/r/Makita/comments/1nn42ui/made_the_first_step_into_xgt/,[],"['chainsaw', 'hedge trimmer', 'string trimmer', 'battery', 'cordless', 'brushless']"
Makita,"BL1890 - photos, info","I've now got two Makita BL1890 battery packs.

I've taken a bunch of photos, here's an imgur gallery.
https://imgur.com/a/7Jjpqen

I included dimensions taken with calipers, weight using a scale, as well as size comparisons with a BL1860B, and finally battery on tool photos, DLM460 (they fit perfectly with the lid closed), DHR243, DUC353, and for me, the most interesting of all, PDC01.

They don't *quite* let the lid of the PDC01 close, but it's good enough. Maybe they'll make a new lid, it woul",19,21,1758893976.0,https://www.reddit.com/r/Makita/comments/1nr1mmn/bl1890_photos_info/,https://reddit.com/r/Makita/comments/1nr1mmn/bl1890_photos_info/,[],['battery']
Makita,Makita 18V LXT 3AH battery charging problem,"Hello, fellow Makita users! I hope my question
is not too stupid, but I just want to make sure
that I've found the issue with my battery. So..
I bought this battery from the flea market, it was very discharged and I've tried to connect
it to a brand new 18V 6AH battery to get some
juIce into it before putting it on the charger.
Everything was fine and well, even charged the
battery twice and the red light on the charger
started flashing despite the fact that the
battery wasn't even warm. I've de",19,6,1758738679.0,https://www.reddit.com/gallery/1npk1pn,https://reddit.com/r/Makita/comments/1npk1pn/makita_18v_lxt_3ah_battery_charging_problem/,[],['battery']
Makita,Where is the serial number? Bought on Amazon,I can’t find the serial number on the impact drill I bought on Amazon. ,4,6,1758814435.0,https://i.redd.it/fq6e6xgbybrf1.jpeg,https://reddit.com/r/Makita/comments/1nq9z7e/where_is_the_serial_number_bought_on_amazon/,[],['drill']
Makita,XGT drill,"Was looking at upgrading to a XGT drill from my Dewalt DCD999 Flexvolt drill with a 6.0 battery. I honestly hate the dewalt. Its made out of cheap plastic, the LED light went bad after a month, and the motor rotates while you try to tighten the chuck. The drill honestly feels like it came in a mcdonalds happy meal.

How does the XGT drill compare to the DCD999? 

Thanks. ",4,14,1758586584.0,https://www.reddit.com/r/Makita/comments/1no2zfs/xgt_drill/,https://reddit.com/r/Makita/comments/1no2zfs/xgt_drill/,['cheap'],"['drill', 'battery', 'chuck']"
Makita,Rotary hammer x Hammer drill,"Hello all, I need to drill in reinforced concrete apartments and oocasionally in panel house apartments (prefabricated concrete slabs - popular pre1990 in Germany, Eastern Europe). DIY, not professional, occasional heavier use (walk in closet, kitchen installation), also just hanging pictures, light fixtures, shelves.

I have Makita DHP485 with hammer function which barely does the job if I have patience and use the Bosch blue drill bits. I would like something stronger for the task. I have thre",4,13,1758542571.0,https://www.reddit.com/r/Makita/comments/1nnkkgw/rotary_hammer_x_hammer_drill/,https://reddit.com/r/Makita/comments/1nnkkgw/rotary_hammer_x_hammer_drill/,"['recommend', 'recommend', 'alternative', 'new to', 'apartment', 'apartment']","['drill', 'multitool', 'cordless']"
Makita,Drt50 stopped working,"I have a drt50 router, was working this morning , I turned of the machine to change bits and it wouldn't start anymore. Eventually brought it in for repair but did people have this issue also? I have it for less than a year and not abusing it. I do everything in multiple passes etc",1,2,1758553607.0,https://www.reddit.com/r/Makita/comments/1nnp0ui/drt50_stopped_working/,https://reddit.com/r/Makita/comments/1nnp0ui/drt50_stopped_working/,['stopped'],['router']
Ryobi,In search of light weight tool set - pleasant surprise using the small Ryobi Lithium USB FVD50 screwdriver,"I'm working towards a lightweight carry bag that has only the core things needed to deal w/ 90% of general home jobs. 

My regular sized Ryobi PSBDD01 drill and battery were the heaviest items in my bag. I researched several electric screwdriver options and saw that Ryobi has one in their newer Lithium USB lineup but saw terrible reviews for it online and especially over at the ""Project Farm"". It kept stalling out and didn't have the torque to pass all the tests.

But, on a whim, I grabbed one (",26,50,1758720484.0,https://i.redd.it/ctiitxf054rf1.jpeg,https://reddit.com/r/ryobi/comments/1npc53r/in_search_of_light_weight_tool_set_pleasant/,[],"['drill', 'battery', 'torque']"
Ryobi,Good first tool?,"*** EDIT: Model# PBLDD02

Just got a new house. I’m thinking this one would be a good starter drill that can do it all?",19,27,1758516615.0,https://i.redd.it/nbdihvxqcnqf1.jpeg,https://reddit.com/r/ryobi/comments/1nndfs3/good_first_tool/,[],['drill']
Ryobi,Accidently let the magic smoke out,"In this video you can clearly see some of the magic smoke still coming out of my drill. However as you can see it still works. That said dont be mislead by this video, A LOT came out before I could get my phone ready. Therefore it seems like the motor is probably fine, so I suspect it is likely my brush burning out. Therefore I must ask, has anyone had this happen? Is there anything I can do or should I just start shopping for its replacement, or can I fix this. Im not sure if its relevant but i",18,19,1758487708.0,https://v.redd.it/yyzroxwiykqf1,https://reddit.com/r/ryobi/comments/1nn38f5/accidently_let_the_magic_smoke_out/,[],['drill']
Ryobi,Need Advice: PCL704K vs PCL705K for Litter Box Cleanups,"I’m trying to decide between the PCL704K (Performance model) and PCL705K (Multi-Surface model) handheld vacuums. My main use case is quick cleanups of cat litter bits around the litter box on tiled floors, 1-2 times per day.

From what I can tell, PCL704K seems to have stronger suction and comes with a crevice tool and dust brush. PCL705K is multi-surface, compatible with 1-1/4” accessories, and has a dual filter system, but suction may be slightly lower.

I’m trying to weigh power vs versatilit",11,27,1758852694.0,https://www.reddit.com/gallery/1nqpew8,https://reddit.com/r/ryobi/comments/1nqpew8/need_advice_pcl704k_vs_pcl705k_for_litter_box/,"['advice', 'advice']",['vacuum']
