subreddit,title,selftext,score,num_comments,created_utc,url,permalink,demand_signals,matched_keywords
appliances,Please share your opinions about Amana and Whirlpool dishwasher.,"Iam in market for new dishwasher .

Bosch is the most popular one here but even their 100 series comes with wifi.

I checked local stores and Costco. 

Amana and whirlpool have better ratings.
Is there any particular model you recommend for these two ?

The other question is - is this a good time to buy one from cost point of view ?

I need normal dishwasher that will not talk to me, my mom, or to any other appliances in my house. 

Thank you for your time!! 


",7,20,1758844150.0,https://www.reddit.com/r/Appliances/comments/1nqmfwb/please_share_your_opinions_about_amana_and/,https://reddit.com/r/Appliances/comments/1nqmfwb/please_share_your_opinions_about_amana_and/,['recommend'],['dishwasher']
appliances,"Bought a brand new dishwasher from Lowes, there was moisture inside and water came out of the drain hose..is that normal?","Bought a brand new dishwasher from Lowes and got it home, out of the box and in the house and I noticed when I opened the door it was a little moist inside, then I went to grab the drain hose and it poured about a half cup of water on my floor. Is that normal or did I get a potentially used/returned dishwasher? ",7,21,1758476793.0,https://www.reddit.com/r/Appliances/comments/1nmyhfl/bought_a_brand_new_dishwasher_from_lowes_there/,https://reddit.com/r/Appliances/comments/1nmyhfl/bought_a_brand_new_dishwasher_from_lowes_there/,[],['dishwasher']
BuyItForLife,Our Bosch dishwasher from 1988,"Here is our Bosch S9N51B from 1988, I thought you guys would appreciate it! I had to fish some plastic out of the impeller this evening as it stopped draining. Thought it had finally died but nope, still going strong! We use it several times a day. I'm impressed how well the internal plastics have aged, nothing is brittle or broken, easy to service too.",581,60,1758999535.0,https://i.redd.it/qunykvcp8rrf1.jpeg,https://reddit.com/r/BuyItForLife/comments/1ns3a0p/our_bosch_dishwasher_from_1988/,"['stopped', 'died']",['dishwasher']
BuyItForLife,"I took this picture in 2000, and never changed the battery. it is just an am radio from 1968, still works fine.","# Vintage Panasonic Super 7 Transistor Radio, Model R-1158 (Avalon), AM Band, 7 Transistors, Made In Japan, Circa 1968",372,52,1758747072.0,https://i.redd.it/6hv3lrwmd6rf1.jpeg,https://reddit.com/r/BuyItForLife/comments/1npno75/i_took_this_picture_in_2000_and_never_changed_the/,[],['battery']
BuyItForLife,What's the best no-frills coffee maker?,"My mom called me today saying her coffee maker finally broke. She practically lives on coffee, morning and night, but here's the thing: she doesn't understand electronics at all. She grew up working the cotton fields, never really learned technology, and doesn't even know how to text.

She only drinks her coffee black, nothing fancy. No timers, no apps, no ""smart"" anything. I'm just looking to buy her the most reliable, simple, push-a-button-and-it-brews coffee maker out there. Something that wo",217,406,1758898969.0,https://www.reddit.com/r/BuyItForLife/comments/1nr3p9r/whats_the_best_nofrills_coffee_maker/,https://reddit.com/r/BuyItForLife/comments/1nr3p9r/whats_the_best_nofrills_coffee_maker/,"['how to', ""what's the best"", 'recommend']",['coffee maker']
BuyItForLife,LG - the worst product support I've ever experienced,"Just want to spread a word of warning to anyone considering an LG product, as I previously considered them a solid Buy It for Life brand. I own a lot of LG stuff and they were my go to until recently. TL;DR: their support process is awful.

I bought a new LG microwave in May. It worked great for 3 months then in August it inexplicably stopped working. Lights came on, all the buttons worked, but no heating occurred within. So I contacted LG support. The microwave has a 1 year warranty so that sho",158,44,1758575015.0,https://www.reddit.com/r/BuyItForLife/comments/1nnyjkf/lg_the_worst_product_support_ive_ever_experienced/,https://reddit.com/r/BuyItForLife/comments/1nnyjkf/lg_the_worst_product_support_ive_ever_experienced/,"['stopped', 'died']","['oven', 'microwave']"
BuyItForLife,Kenwood A701A - Family Heirloom,"This beast was my grandmothers from her time as a professional cake maker and decorator and she very recently bestowed it upon me. I thought it had to be 1970s, but i'm learning that it was probably 1960s made which has completely blown my mind as it's still going strong.

Literally do not bake without it. They knew how to make things to last back in the day, new mixers break in like a year. Not this beast!",121,3,1758661448.0,https://i.redd.it/vhakbwpebzqf1.jpeg,https://reddit.com/r/BuyItForLife/comments/1notdfz/kenwood_a701a_family_heirloom/,['how to'],['mixer']
BuyItForLife,My 2018 ebike’s odometer. Original motor and battery.,I relied on this bike as my main daily commuter/grocery getter for 4 years in a cold Canadian city. (Had to use public transport on super cold days) It’s a 2018 Haibike sduro cross 6.0 with the early Yamaha PW system. I have absolutely no problem with both motor and battery even though the range has degraded slightly. ,75,25,1758577895.0,https://i.redd.it/v3t6manyesqf1.jpeg,https://reddit.com/r/BuyItForLife/comments/1nnzq1b/my_2018_ebikes_odometer_original_motor_and_battery/,[],['battery']
BuyItForLife,Avoid Dyson fan/air purifiers,"I have a Dyson vacuum cleaner that's been going strong for well over a decade so, when I eas in the market for a fan, decided to splurge big on one of their fans/air purifier combos.

It worked great at first but, after a few months of regular use, the motor developed a loud annoying whine that made it impossible to use in the bedroom.

I had Dyson repair or replace the fan over 5 times during the warranty period and every single one developed the same problem after a few months.

Ended up movin",38,24,1758650423.0,https://www.reddit.com/r/BuyItForLife/comments/1nooj6v/avoid_dyson_fanair_purifiers/,https://reddit.com/r/BuyItForLife/comments/1nooj6v/avoid_dyson_fanair_purifiers/,[],"['vacuum', 'air purifier']"
BuyItForLife,Best toaster to buy right now,"My old toaster finally broke after 5 years. Looking for a replacement that will hopefully last me the rest of my life. I have a family of 4 so a 4 slice would be great but I am open to others. Budget is not really an issue so any price works as long as the toaster justifies it. 

Thanks for the recs ",25,27,1758540420.0,https://www.reddit.com/r/BuyItForLife/comments/1nnjva1/best_toaster_to_buy_right_now/,https://reddit.com/r/BuyItForLife/comments/1nnjva1/best_toaster_to_buy_right_now/,['budget'],['toaster']
fixit,Droning/whirring noise from clothes dryer.,"My clothes dryer has been making a squealing/droning noise for a while, intermittently at first, then constantly in the last few weeks.

I have just replaced the belt and the bearings which has helped, but now it seems like a different loud whirring noise. It is a Fisher and Paykel ED56. It is drying clothes without issue other than the sound.

The particular sound is most apparent in the video when my camera is at the back of the unit. (The banging is just dryer balls). It is the whirring noise",8,3,1758887197.0,https://v.redd.it/d4o3j8znyhrf1,https://reddit.com/r/fixit/comments/1nqz65s/droningwhirring_noise_from_clothes_dryer/,['advice'],['dryer']
fixit,Leaking Dishwasher - Found the leak but what is it?,Found this component leaking under my dishwasher. Is this an easy DIY fix?,3,11,1758450442.0,https://v.redd.it/n0lr0hazvhqf1,https://reddit.com/r/fixit/comments/1nmohaj/leaking_dishwasher_found_the_leak_but_what_is_it/,[],['dishwasher']
fixit,Refrigerator makes clicking noise every 15min,"For last 24hrs, every 15ish minutes, fridge makes clicking noise that last 30ish seconds. Fridge is 3 years old. Fridge and freezer portion functions fine, other than being obnoxiously loud. It has not shut off, and back does not feel hot. I think it is the compressor, but have been unable to find other’s with similar sound. Could anyone help?",4,6,1758589336.0,https://v.redd.it/0fzhy724ctqf1,https://reddit.com/r/fixit/comments/1no3y27/refrigerator_makes_clicking_noise_every_15min/,[],['refrigerator']
fixit,How do I remove these plastic clips on the thermal fuse for my dryer,Question in title. I have a Kenmore oasis dryer and I believe the fuse is shot based off of what I have read online and in the tech sheet with the error code (F40),4,13,1758580347.0,https://www.reddit.com/gallery/1no0p54,https://reddit.com/r/fixit/comments/1no0p54/how_do_i_remove_these_plastic_clips_on_the/,['how do i'],['dryer']
Appliances,Are there no decent refrigerators left in this cruel world?,"Yes I’m being dramatic…but also I’m so lost on what refrigerator to purchase! Obviously everything will have some bad reviews. 

TLDR: We have 2 refrigerators. Our main fridge broke recently. The other one is very basic bottom of the line, pretty small, works but we need filtered water and an ice maker. Need help or advice finding a new one! 


This is the situation: 

We’ve had our French door, water dispenser on the outside, whirlpool fridge for about 5.5 years. Now it won’t stop beeping and w",2531,1026,1758602475.0,https://www.reddit.com/gallery/1no89k6,https://reddit.com/r/Appliances/comments/1no89k6/are_there_no_decent_refrigerators_left_in_this/,"['advice', 'advice', 'need help', 'budget', 'cheap']",['refrigerator']
Appliances,I have made the best purchase of my life.,"I looked it up, dishwashers are appliances, do counter-top dishwashers count for this subreddit? I hope so.

My aunt recommended this to me, and my god, I haven't had a full set of clean dishes in months. I always just rewashed the same cutlery/plates over and over because of work, college (I'm 19) and I'm lazy.

God, I sound so much like my dad it's crazy.

(I've never owned/saw any type of dishwasher before in my life, in person, until this point.)",1212,152,1758735507.0,https://www.reddit.com/gallery/1npinn0,https://reddit.com/r/Appliances/comments/1npinn0/i_have_made_the_best_purchase_of_my_life/,['recommend'],['dishwasher']
Appliances,Roach in the screen of my oven clock… am I screwed?,"For reference, I live in an apartment complex that is supposed to be “Luxury”, according to them. The complex itself was built probably 10 years or less ago, so fairly new. They do regular pest control once every like 6 months where they come in and spray chemicals around our unit and building to deter pests. But, I woke up this morning and to my surprise, noticed a roach moving around behind the screen of my oven clock! I am a very clean and tidy person, I don’t leave dishes in the sink for lon",558,106,1758817089.0,https://i.redd.it/2m7fb2l76crf1.jpeg,https://reddit.com/r/Appliances/comments/1nqb4wz/roach_in_the_screen_of_my_oven_clock_am_i_screwed/,"['advice', 'apartment']","['dishwasher', 'oven', 'microwave', 'vacuum']"
Appliances,Impulse Cooktop Initial Impressions,"I recently redid my kitchen and put in an Impulse induction cooktop.  They’re very new and it’s hard to find much info on them, so I figured I’d share my thoughts.

I’m not affiliated with Impulse in any way.  Bought the unit on my own, decided to share my thoughts independently.

For context, I’ve always cooked on gas.  I cook a wide variety of foods, rarely the same thing twice.  I’ve dabbled in induction cooktops before, but not a lot.

I was ultimately motivated to switch from gas for the in",178,17,1758671190.0,https://www.reddit.com/r/Appliances/comments/1nox7zk/impulse_cooktop_initial_impressions/,https://reddit.com/r/Appliances/comments/1nox7zk/impulse_cooktop_initial_impressions/,[],['battery']
Appliances,Why does my oven have an ethernet port?,,104,70,1758493554.0,https://i.redd.it/oawidre5glqf1.jpeg,https://reddit.com/r/Appliances/comments/1nn5kzk/why_does_my_oven_have_an_ethernet_port/,[],['oven']
Appliances,Washing machine stinks,What is the easiest way to make our machine smell good?,98,267,1758455667.0,https://v.redd.it/cjfo7ztgbiqf1,https://reddit.com/r/Appliances/comments/1nmpzdh/washing_machine_stinks/,[],['washing machine']
Appliances,anybody know what this black liquid is in my microwave?,"we've been seeing this black liquid in our microwave. It's a bit viscous but doesn't quite seem like grease from food. It always gets pooled on the right side of the microwave. I can't really seem to figure out where it's coming from except a tiny spot in the top where it might be dripping down but there's no hole there afaik. I'm guessing i'll have to replace this microwave but just wanted to see if anyone can help me figure it out 

",85,62,1758728506.0,https://i.redd.it/yh3qycohu4rf1.jpeg,https://reddit.com/r/Appliances/comments/1npfjy0/anybody_know_what_this_black_liquid_is_in_my/,[],['microwave']
Appliances,Wife put a mug of bacon grease in the dishwasher,"My wife somehow failed to notice that I had filled a coffee mug ~1/2 full with bacon grease, which had solidified, and put it in the dishwasher and ran a cycle. Everything obviously came out covered in grease so we ran again and the dishes seem fine, but I’m worried about long-term effects to the drain/pump/pipes. Anyone have any experience with something like this?",68,61,1758665400.0,https://www.reddit.com/r/Appliances/comments/1nov0k6/wife_put_a_mug_of_bacon_grease_in_the_dishwasher/,https://reddit.com/r/Appliances/comments/1nov0k6/wife_put_a_mug_of_bacon_grease_in_the_dishwasher/,['failed'],['dishwasher']
Appliances,Confused about what kind of washing machine i own,I purchased a refurbished washing machine when I bought my current home 4 years ago from someone in my area that is well known for selling refurbished appliances and does FANTASTIC work. In the last couple of weeks my washing machine has stopped filling all the way no matter which water level setting you choose. I've taken the hoses off the back and made sure there are no kinks in them and that the sediment filters were clean but that didn't fix the problem. My next thought is that the water fil,60,38,1758556682.0,https://www.reddit.com/gallery/1nnqdzg,https://reddit.com/r/Appliances/comments/1nnqdzg/confused_about_what_kind_of_washing_machine_i_own/,"['how do i', 'stopped']",['washing machine']
Appliances,The small but mighty!,"Recently got this guy! Our budget rental doesn’t have a dishwasher and I’ve wanted one for 4 years. It’s just my husband and I but dishes pile up. Highly recommend! 

I use a high quality dish pod and it cuts through sticky honey Asian sauce like nothing. It comes with a pitcher to fill it with or connect to sink. (I use pitcher). Drain hose to the sink. It even dries! Cycle with dry is 2hrs or rapid without dry is 40min. ",53,23,1758907660.0,https://www.reddit.com/gallery/1nr7gti,https://reddit.com/r/Appliances/comments/1nr7gti/the_small_but_mighty/,"['recommend', 'budget', 'rental']",['dishwasher']
Appliances,SOS!! Washing Machine Shaking!,"Just bought this brand new washer and dryer this is the second time trying to do a load in the washing machine and this keeps happening the floor is level/even and we put the feet on the washing machine, the drum does not seem to be loose so how can we fix this? Please help 😭😭😭😭
",53,73,1758648930.0,https://v.redd.it/rct944q6ayqf1,https://reddit.com/r/Appliances/comments/1nonvao/sos_washing_machine_shaking/,[],"['washing machine', 'dryer']"
Appliances,Bosch 800 dish washer - died after 5 years - but did I cause its death?,"I bought a Bosch 800 dish washer after having an (old) Whirlpool that really never got dishes clean.  The Bosch lasted 5 years until it suddenly no longer works.  No certified Bosch repair people in my mid sized town/city.  When calling repair people, I was asked ""How long do you expect a dish washer to last!!!???!!""  This reminded me of the responses I got when trying to get the old Whirlpool fixed.  On those calls, I was told that a dish washer is meant to last 5 to 7 years, so if I got that, ",43,220,1758894629.0,https://www.reddit.com/r/Appliances/comments/1nr1vyk/bosch_800_dish_washer_died_after_5_years_but_did/,https://reddit.com/r/Appliances/comments/1nr1vyk/bosch_800_dish_washer_died_after_5_years_but_did/,"['recommend', 'died', 'died']",['dishwasher']
Appliances,"New dishwasher, what is this?",Got a new dishwasher with this piece on the right side of the bottom rack. Anyone know what it is for? It folds up vertical or lays out horizontal. ,36,57,1758484975.0,https://i.redd.it/g1c6harnqkqf1.jpeg,https://reddit.com/r/Appliances/comments/1nn22et/new_dishwasher_what_is_this/,[],['dishwasher']
Appliances,Dishwasher rack is rusting,"So my KitchenAid dishwasher is about 4 years old.  We're running into an issue where the racks themselves are losing the plastic coating and the wire underneath is rusting. About a year and a half ago, a piece of the wire on the top rack actually broke off and ripped apart the screen on the motor/pump housing, which turned into a fairly costly repair. I fixed the top rack with some liquid vinyl repair and some plastic wire caps, and it seems okay still, but now the bottom rack is experiencing th",30,41,1758992123.0,https://www.reddit.com/gallery/1ns07df,https://reddit.com/r/Appliances/comments/1ns07df/dishwasher_rack_is_rusting/,[],['dishwasher']
Appliances,Can I drill a hole here?  LG LTCS24223S,"Hello All, I have these kegs inside my fridge, and I was wondering if I could make a 5/16"" hole in the left side, and run the air line, or dispense line through it. I'm opening the fridge 10 times a day to dispense bubble water and I'm sure its wasteful. 

Reason I ask is I don't know if the refrigerant lines are in the back wall, or sides. ",32,47,1758724207.0,https://www.reddit.com/gallery/1npdo43,https://reddit.com/r/Appliances/comments/1npdo43/can_i_drill_a_hole_here_lg_ltcs24223s/,"[""don't know""]",['drill']
Appliances,Just scored a new apartment; this is the state of my Miele washer.,"I moved in a week ago, two days ago I went to use the washer for the first time and got hit with a god-awful stench. Maintenance guy came yesterday and ran a laundry bomb through it, today I actually took a good look and noticed a ton of black, hairy gunk built up in the door gasket. I dug most of it out with a bleach-soaked rag this black shit just isn’t rubbing off. It’s mold, isn’t it? Is this bad enough that an entirely new washing machine is necessary, or can this rubber be replaced on its ",32,36,1758578572.0,https://www.reddit.com/gallery/1nnzzzr,https://reddit.com/r/Appliances/comments/1nnzzzr/just_scored_a_new_apartment_this_is_the_state_of/,"['first time', 'apartment', 'apartment']",['washing machine']
Appliances,Frigidaire dishwasher standing water,"Hello. I recently moved and this Frigidaire dishwasher has been a pain. 
There is disgusting standing water. I remove it by hand, but then after a wash its still there again. 
I removed all the parts and filter, cleaned them (they were not dirty to begin with), got a new arm, did the baking soda + vinegar, but its still the same. 

The water is always this level, never overflowing or spilling on the floor. And this dishwasher doesnt open by itself when done so the dishes get like a oily layer an",18,28,1758650005.0,https://i.redd.it/279de1qddyqf1.jpeg,https://reddit.com/r/Appliances/comments/1noocfu/frigidaire_dishwasher_standing_water/,[],['dishwasher']
Appliances,Ever replaced something this old? Was it an easy install?,"We just moved into a fixer upper that has a dishwasher that's at least 40 years old. We can't even open it. We got a Lowe's gift card and plan to replace it ASAP, but I am not sure if we should pay for their installation services. I worry that it will be more complicated and they won't be able to do it. I've heard they don't refund the $. Has anyone ever had something this old replaced? Did you hire a plumber/electrician or was it an easy install?",19,30,1758992989.0,https://www.reddit.com/gallery/1ns0k90,https://reddit.com/r/Appliances/comments/1ns0k90/ever_replaced_something_this_old_was_it_an_easy/,[],['dishwasher']
Appliances,Should I buy a “garage ready” refrigerator for my garage?,"Or, will a regular refrigerator be fine?  The garage has no heating or cooling.",15,41,1758662676.0,https://www.reddit.com/r/Appliances/comments/1notw4l/should_i_buy_a_garage_ready_refrigerator_for_my/,https://reddit.com/r/Appliances/comments/1notw4l/should_i_buy_a_garage_ready_refrigerator_for_my/,[],['refrigerator']
Appliances,Buyer Beware If Buying Hisense Refrigerator,"Hello, this is a copy of my response to a post from someone who purchased the exact same Hisense refrigerator as I did. This has happened over the course of this month September 2025. And as of today, is still ongoing. Buyer Beware!

Hey how is the Hisense working for you after all this time? We have the same unit and after 1.5 years it is dead. Hisense warranty (2 yrs) sounds good, until they can't find a repair person/company willing to work on it. (Day 1 Monday) We called the number from the ",13,12,1758558699.0,https://www.reddit.com/r/Appliances/comments/1nnrarj/buyer_beware_if_buying_hisense_refrigerator/,https://reddit.com/r/Appliances/comments/1nnrarj/buyer_beware_if_buying_hisense_refrigerator/,['failed'],['refrigerator']
Appliances,I have made the best purchase of my life.,"I looked it up, dishwashers are appliances, do counter-top dishwashers count for this subreddit? I hope so.

My aunt recommended this to me, and my god, I haven't had a full set of clean dishes in months. I always just rewashed the same cutlery/plates over and over because of work, college (I'm 19) and I'm lazy.

God, I sound so much like my dad it's crazy.

(I've never owned/saw any type of dishwasher before in my life, in person, until this point.)",12,2,1758735471.0,https://www.reddit.com/gallery/1npin3i,https://reddit.com/r/Appliances/comments/1npin3i/i_have_made_the_best_purchase_of_my_life/,['recommend'],['dishwasher']
Appliances,Upgraded dishwasher worth it?,"We have whirlpool dishwasher, put in by builders, ~3 years old.  Needs a ~$300 repair. 

We use our dishwasher almost daily, we don’t pre wash much, just a rinse.  We use a lot of plastic with our kids and us.  We use sanitizer cycle often with heat dry.

Even with that, almost all plastic comes out wet, we have to place it in a drying rack before putting away. 

Looking at upgrading to a Bosch 800, or something similar (open to suggestions).  We want something that dries well.

$1500 price tag ",9,33,1758637786.0,https://www.reddit.com/r/Appliances/comments/1noixko/upgraded_dishwasher_worth_it/,https://reddit.com/r/Appliances/comments/1noixko/upgraded_dishwasher_worth_it/,[],['dishwasher']
Appliances,Top-load washer leaving white streaks on clothes,"I moved into this house in February and this has been a constant thing. We notice it only on black clothes (probably just because they're dark). I am able to rub it off with a damp towel but it happens every wash. I have done a wash of the washing machine and installed a water softener. Sometimes, it is loose like lint (first pic) and sometimes it seems to be engrained in the fabric (second pic).

In the third pic is a dish rag which has these little white globs (texture of snot) - not sure if i",7,10,1758596036.0,https://www.reddit.com/gallery/1no68rp,https://reddit.com/r/Appliances/comments/1no68rp/topload_washer_leaving_white_streaks_on_clothes/,[],['washing machine']
Appliances,My Heir refrigerator makes this annoying sound. Anyway to troubleshoot or is this normal?,,6,7,1758563792.0,https://v.redd.it/lhq4cwk09rqf1,https://reddit.com/r/Appliances/comments/1nntl03/my_heir_refrigerator_makes_this_annoying_sound/,[],['refrigerator']
Appliances,My dishes chip in the dishwasher,"I have been using this Samsung dishwasher for a year and I find that my bowls tend to chip. It can happen whether they are in the higher or lower chamber. I usually place them like this so no one touches each other. I use the auto setting for wash and dishwasher pods. When I used to wash them in a Bosch dishwasher before this one they didn’t chip before. 

Any ideas? Thank you!",7,13,1758544895.0,https://i.redd.it/0if5do2uopqf1.jpeg,https://reddit.com/r/Appliances/comments/1nnldv9/my_dishes_chip_in_the_dishwasher/,[],['dishwasher']
Appliances,Do you have mixed appliances brands?,Hi all! Our dishwasher broke after 7 years using it and now Im in hunting for a new one. When we built our home all the appliances that came with is from GE profile brand. Im looking for a kitchen aid stainless dishwasher (the stainless would match the look with the others appliances but my OCD is being a problem here haha Before I hit the buy it button I would like some honest advices about mixing appliances brands! Thanks,6,48,1759007227.0,https://www.reddit.com/r/Appliances/comments/1ns6daa/do_you_have_mixed_appliances_brands/,https://reddit.com/r/Appliances/comments/1ns6daa/do_you_have_mixed_appliances_brands/,['advice'],['dishwasher']
Appliances,Please share your opinions about Amana and Whirlpool dishwasher.,"Iam in market for new dishwasher .

Bosch is the most popular one here but even their 100 series comes with wifi.

I checked local stores and Costco. 

Amana and whirlpool have better ratings.
Is there any particular model you recommend for these two ?

The other question is - is this a good time to buy one from cost point of view ?

I need normal dishwasher that will not talk to me, my mom, or to any other appliances in my house. 

Thank you for your time!! 


",6,20,1758844150.0,https://www.reddit.com/r/Appliances/comments/1nqmfwb/please_share_your_opinions_about_amana_and/,https://reddit.com/r/Appliances/comments/1nqmfwb/please_share_your_opinions_about_amana_and/,['recommend'],['dishwasher']
