subreddit,title,selftext,score,num_comments,created_utc,url,permalink,demand_signals,matched_keywords
lawncare,New Lawnmower Blades are a Good Thing,"Inland PNW. I’ve never stuck a new blade on an old lawn mower. Typically I just sharpen the old one through the life of the mower. I decided that this blade had lost enough metal, but the engine was still solid, so I bought a new blade. It’s literally like having a new mower. 😁 ",61,9,1757855158.0,https://i.redd.it/vrwtkx3wp4pf1.jpeg,https://reddit.com/r/lawncare/comments/1ngqtn2/new_lawnmower_blades_are_a_good_thing/,[],"['lawn mower', 'blade']"
AutoDetailing,Pressure Washer Wall Mount Setup,"Finally got around to mounting my pressure washer on the wall. It's a game changer! As a hobbyist home car detailer, this has made the experience much more enjoyable and allows me to do weekly washes quickly.",485,64,1757698963.0,https://www.reddit.com/gallery/1nf9pr0,https://reddit.com/r/AutoDetailing/comments/1nf9pr0/pressure_washer_wall_mount_setup/,[],['pressure washer']
AutoDetailing,Budget Active 2.0 garage setup,"
A basic setup compared to some really nice stuff I've seen on here, but happy with the results.

Washed two vehicles so far and they went well. Setup, wash, and cleanup took about an hour each....still figuring things out and wonder how that compares, but it’s way faster than what I’m used to. I was initially a little worried about return on investment, but I'm calling it a win. 

Already have a bigger gas washer, but dragging it back and forth from the shed, setup, etc. was eliminating any tim",108,10,1757820147.0,https://i.redd.it/r2mhz3fst1pf1.jpeg,https://reddit.com/r/AutoDetailing/comments/1nggmxa/budget_active_20_garage_setup/,['budget'],['air compressor']
AutoDetailing,Cleaning techniques for multispoke?,"I usually use a skinny microfiber brush with diablo wheel cleaner but are there any better recommendations?

These are powder coated gloss black w/ ceramic coating, but I find can be ""swirled"" if I used the microfiber brush on a drill for example.",10,20,1757437889.0,https://i.redd.it/vohiwrp196of1.jpeg,https://reddit.com/r/AutoDetailing/comments/1ncorjv/cleaning_techniques_for_multispoke/,['recommend'],['drill']
MechanicAdvice,I have no idea what I did wrong,I just replaced my front control arms on both sides and the wheel bearing on the passenger side. When I turn the steering wheel both of the wheels move just fine but they're not even close to being lined up. I also noticed that the driver side rides a couple inches higher than the passenger side but I'm not sure if it already did that. I haven't torqued any of the bolts for the control arms yet because I read that I'm supposed to do it with the weight on the suspension. I did torque all of the b,121,71,1757638589.0,https://www.reddit.com/gallery/1nepqbm,https://reddit.com/r/MechanicAdvice/comments/1nepqbm/i_have_no_idea_what_i_did_wrong/,['advice'],['torque']
MechanicAdvice,Still stuck on my torque converter of anyone has more advice,,62,49,1757705336.0,https://v.redd.it/1a1topc7csof1,https://reddit.com/r/MechanicAdvice/comments/1nfcf16/still_stuck_on_my_torque_converter_of_anyone_has/,['advice'],['torque']
appliances,UPDATE: Why is my dishwasher so splotchy and brown?,"Original post: https://www.reddit.com/r/Appliances/comments/1naa4ji/why_is_my_dishwasher_so_splotchy_and_brown/

It's both amusing and embarrassing that my splotchy dishwasher got so much traction 😭. Thank you all who gave me helpful tips, and a laugh. Definitely kind of gross, but I swear it wasn't mold!

Admittedly though, I got a bit overwhelmed by all the responses that I just hopped in my car, went to the nearest grocery store, and bought some big box dishwasher cleaner pods. The top ingred",2321,139,1757446838.0,https://www.reddit.com/gallery/1ncsue5,https://reddit.com/r/Appliances/comments/1ncsue5/update_why_is_my_dishwasher_so_splotchy_and_brown/,[],['dishwasher']
appliances,I just accidentally smashed my microwave door. Is it worth it to replace the door or just get a new microwave?,,485,272,1757698145.0,https://i.redd.it/4vu3bil0rrof1.jpeg,https://reddit.com/r/Appliances/comments/1nf9d93/i_just_accidentally_smashed_my_microwave_door_is/,[],['microwave']
appliances,Does anyone know why this part of my sink starts spewing water out while my dishwasher is on/draining?,,132,63,1757731145.0,https://i.redd.it/0e4ddw35huof1.jpeg,https://reddit.com/r/Appliances/comments/1nfm6xs/does_anyone_know_why_this_part_of_my_sink_starts/,['does anyone know'],['dishwasher']
appliances,F Samsung and all their crap appliances,"There’s exactly 376 screws to remove to get that screen out to clean it and the overly complex sump that accumulates tons of sludge underneath. 

I also have a POS Samsung refrigerator. 

F these MFers! ",131,45,1757800636.0,https://i.redd.it/jjxubstr70pf1.jpeg,https://reddit.com/r/Appliances/comments/1ng9xlc/f_samsung_and_all_their_crap_appliances/,[],['refrigerator']
appliances,"Dumb question, but when is a dishwasher overfilled? Safe to put dishes in middle?","Okay so I'm always unsure so I wanted to say screw it and just ask - is it okay to put dishes in the center of the bottom rack here? Like smaller bowls over the shorter pegs? I worry it will block too much water flow and the top rack or other dishes won't get a good spray, so I rarely put anything there. Are the smaller pegs intended for small plates in the middle?

Top rack also has a spinning water thing under it too, and it mainly has mugs and smaller things on it.",95,84,1757620843.0,https://i.redd.it/7bq93ns4dlof1.jpeg,https://reddit.com/r/Appliances/comments/1neixuc/dumb_question_but_when_is_a_dishwasher_overfilled/,[],['dishwasher']
appliances,Total newbie with dishwashers. Went to clean thefilter and this cavity is filled with water. Normal or bad?,,64,35,1757691595.0,https://i.redd.it/0g6hn7fj7rof1.jpeg,https://reddit.com/r/Appliances/comments/1nf6jtk/total_newbie_with_dishwashers_went_to_clean/,[],['dishwasher']
appliances,Just got these Maytag Neptunes for free,Hey everyone. I just got these Maytag Neptune washer and dryer for free from my grandma (score!) after our old machines were damaged from a flood. What’re some things I should know about these machines. My grandma told me they’ve worked perfectly and she’s maintained them up until just wanting newer ones last month. I’m obviously cleaning them thoroughly today and going to run some basic clothes to test them out. Thanks! ,28,6,1757862910.0,https://i.redd.it/w5u6tczxc5pf1.jpeg,https://reddit.com/r/Appliances/comments/1ngtux4/just_got_these_maytag_neptunes_for_free/,[],['dryer']
appliances,Induction or Gas Range?,"I’m currently deciding on appliances for a new build home and thought I was sold on a gas range, but maybe I should consider an induction? 
My biggest fear is that I will get permanent stains. I currently have a glass top electric range, and it is very badly stained, nothing works to clean it, not razors or any cleaner. It’s like the stains are underneath the glass. Is it possible for this to happen with induction? Everything I’ve read says you can clean the induction with a razor/cleaner and th",26,322,1757430791.0,https://www.reddit.com/r/Appliances/comments/1nclm0n/induction_or_gas_range/,https://reddit.com/r/Appliances/comments/1nclm0n/induction_or_gas_range/,[],"['dishwasher', 'microwave']"
appliances,Five year old house with new GE appliances getting replaced one by one,"We built a brand new house during Covid and purchased all new GE applicances (Washer, Dryer, Double oven, Fridge, and dishwasher).  In the last year, we have replaced the dish washer, the washing machine just broke with an estimated repair cost of $2,400 (needless to say we are not repairing it), the seals on the fridge freezer are either cracked or broken so that is close to the end of its ""five-year"" life.  Are GE appliances really that bad?  Is it just current technology?  None of this is cov",25,53,1757522764.0,https://www.reddit.com/r/Appliances/comments/1ndjhgq/five_year_old_house_with_new_ge_appliances/,https://reddit.com/r/Appliances/comments/1ndjhgq/five_year_old_house_with_new_ge_appliances/,[],"['dishwasher', 'washing machine', 'dryer', 'oven']"
appliances,Does anyone know what this is?,"I found it in my insesit front loader washing machine, I rent this place and im panicking. 😭😫",19,28,1757947274.0,https://i.redd.it/3d9ptlrsbcpf1.jpeg,https://reddit.com/r/Appliances/comments/1nhnpqc/does_anyone_know_what_this_is/,['does anyone know'],['washing machine']
appliances,WARNING: Curmudgeon rant,"Anybody old enough to remember how wonderful microwaves used to be? No buttons. One dial.

The people who design all other than like that…have prolly never used a microwave???!!! And then it beeps at you, as if you’re its employee WTF? “Yes, I already know my nachos are ready. I’d like to multitask or be left alone, and eat them in 5 minutes if it’s okay with Westinghouse.”

So I’m house-sitting, and it’s a pleasure so please no money. They gave me frozen pizzas and air fryer wings, perfect. I k",17,15,1757811163.0,https://www.reddit.com/r/Appliances/comments/1ngdpsj/warning_curmudgeon_rant/,https://reddit.com/r/Appliances/comments/1ngdpsj/warning_curmudgeon_rant/,[],"['oven', 'microwave', 'air fryer']"
appliances,Back of washer/dryer all-in-one damaged during the move. Is this safe to use?,,15,31,1757770424.0,https://i.redd.it/b44yuyoxpxof1.jpeg,https://reddit.com/r/Appliances/comments/1nfxmuh/back_of_washerdryer_allinone_damaged_during_the/,[],['dryer']
appliances,"Found a loose nut in washing machine drum, should i be worried?","Found a loose rusty metal nut (around 1,5cm) in my bosch serie 4 varioperfect 5kg washing machine drum, under the rubber next to the drain holes. I dont have a clue for how long its been there. Where could it possibly come from? (its very unlikely that it came from someones pocket)What problem could it indicate? When i try to spin the drum manually, it seems relatively stable (its only a little bit wobbly) and doesnt make any weird noises. ",15,7,1757589231.0,https://i.redd.it/nnmzgjm5riof1.jpeg,https://reddit.com/r/Appliances/comments/1ne603z/found_a_loose_nut_in_washing_machine_drum_should/,[],['washing machine']
appliances,Bluestar 48” range - my review so far,"Bluestar 48” induction range - my review so far

Let me preface with who I am: I am a huge foodie, love to cook (not a baker or chef), I can make a mean Beef bourguignon courtesy of Julia Child, Japanese washoku family dishes (I’m Japanese), and some serious homemade pasta dishes, because I am pretty sure I was Italian in my past life. I also happen to love designing and renovating homes, and have done a ton of research and I’m on my 3rd kitchen renovation since 2010 (3 different houses). 

I sc",14,15,1757903903.0,https://www.reddit.com/gallery/1nha8ws,https://reddit.com/r/Appliances/comments/1nha8ws/bluestar_48_range_my_review_so_far/,[],"['dishwasher', 'oven', 'toaster']"
appliances,My Washing Machine Is a Daily Hero,"Let me tell you what’s made my everyday life so much easier. I used to complain about how I didn't like to wash everyday and how bulk washing used to feel overwhelming. I finally stopped letting my laundry pile up into a mountain and instead started washing a little bit every single day. 
Before now, my weekends were always getting eaten up by endless piles of clothes from the family, baskets stacked everywhere, and the stress of catching up. Now, that chaos is gone.

When the previous machine g",14,2,1757710433.0,https://www.reddit.com/r/Appliances/comments/1nfek1p/my_washing_machine_is_a_daily_hero/,https://reddit.com/r/Appliances/comments/1nfek1p/my_washing_machine_is_a_daily_hero/,['stopped'],['washing machine']
appliances,Damaged microwave safety,Hey! A friend of mine put a metal bowl in my microwave oven and it apparently arced and melted a part of the oven door. How safe is it to use?,10,17,1757539067.0,https://i.redd.it/koj6gofzleof1.jpeg,https://reddit.com/r/Appliances/comments/1ndqkvv/damaged_microwave_safety/,[],"['oven', 'microwave']"
appliances,Anyone successfully replaced wiring harness on GE Monogram wall oven?,"Wife ran self-clean , and door wouldn’t open. I replaced door latch mechanism, and now see wiring is baked. ;). 
Idk if I replace the wiring harness and discover the board is also cooked? Best I can tell I’m going to have to pull the oven as some of the wiring goes through back wall (no connector) . 
I’d love to hear if anyone has been successful with this before ",8,9,1757889863.0,https://www.reddit.com/gallery/1nh5a07,https://reddit.com/r/Appliances/comments/1nh5a07/anyone_successfully_replaced_wiring_harness_on_ge/,[],['oven']
appliances,Dryer only runs for 3 minutes,"The my condo dryer only runs for 3 minutes in all the modes. Even if I set the timer to 1 hour, but the time will be changed after 40s to 3 minutes. Not sure if this is the machine’s problem or i am not using it correctly.",8,19,1757558345.0,https://v.redd.it/saigkzxa7gof1,https://reddit.com/r/Appliances/comments/1ndxhis/dryer_only_runs_for_3_minutes/,[],['dryer']
appliances,How does ventless drying work for an all-in-one washer dryer ?!?,"I want to install an all-in-one washer dryer (AIOWD) combo in my bathroom (so I do not have to use stairs to the basement where I have a W and D.  I am looking at a AIOWD and it has the option of ventless drying and it says it uses cold water to dry the clothes. How the frack does using water dry clothes? That seems like an oxymoron. Can someone explain how this works, if it is legit, can I depend on ventless drying of clothes? There really is no way to vent the unit to the outside.

https://pre",6,38,1757510994.0,https://www.reddit.com/r/Appliances/comments/1nde970/how_does_ventless_drying_work_for_an_allinone/,https://reddit.com/r/Appliances/comments/1nde970/how_does_ventless_drying_work_for_an_allinone/,['can someone'],['dryer']
appliances,Why does this happen in my kitchenaid refrigerator?,"There is water dripping from the top of the refrigeration compartment.  Usually it's a very very slow drip.  Sometimes it doesn't drip at all.

This is the first time it was just leaking like a faucet.

The freezer is working properly.

What can i do to fix this?  Which part could be defective?

I leave ample space behind the refrigeraror for aeration, if that matters",8,8,1757942390.0,https://v.redd.it/hqmuxs0axbpf1,https://reddit.com/r/Appliances/comments/1nhlnju/why_does_this_happen_in_my_kitchenaid_refrigerator/,['first time'],['refrigerator']
appliances,What washer/dryer set do you recommend?,In the market for a new washer and dryer set and all the reviews feel to contradict each other and it feels so hard to choose. Do you have a set you've purchased recently that you'd recommend?,5,28,1757911516.0,https://www.reddit.com/r/Appliances/comments/1nhcot0/what_washerdryer_set_do_you_recommend/,https://reddit.com/r/Appliances/comments/1nhcot0/what_washerdryer_set_do_you_recommend/,"['recommend', 'recommend']",['dryer']
appliances,Is Whirlpool trying to upsell unnecessary stuff during free service?,"I bought a Whirlpool washing machine 6 months ago. Their team has been calling me frequently for a free service. But when they came, they said there’s dust in the water supply and insisted I install a filter for ₹2000. They also suggested adding a floor stand for ₹1500 and a special powder to keep the drum safe.

This feels more like an upsell than actual service. Are these things genuinely needed, or just a way to make extra money off customers? Has anyone else faced this?",4,10,1757600454.0,https://www.reddit.com/r/Appliances/comments/1nea39u/is_whirlpool_trying_to_upsell_unnecessary_stuff/,https://reddit.com/r/Appliances/comments/1nea39u/is_whirlpool_trying_to_upsell_unnecessary_stuff/,[],['washing machine']
appliances,Garage Ready Fridge Necessary?,Does anyone know if a garage ready refrigerator is necessary in places with more mild weather like southern CA? It does get hot but the house is south facing so that also helps.,7,10,1757452020.0,https://www.reddit.com/r/Appliances/comments/1ncv60g/garage_ready_fridge_necessary/,https://reddit.com/r/Appliances/comments/1ncv60g/garage_ready_fridge_necessary/,['does anyone know'],['refrigerator']
appliances,Are the new Bosch dishwashers really worse? What about the Costco models?,"We need a new dishwasher and have always planned to buy Bosch, probably the model 300. But various review sites are saying that the new ones aren’t what they used to be. Others have said that Costco has certain models that are equivalent to the old ones. Are either of these things true? If not Bosch, then what?",6,67,1757419113.0,https://www.reddit.com/r/Appliances/comments/1ncgw9m/are_the_new_bosch_dishwashers_really_worse_what/,https://reddit.com/r/Appliances/comments/1ncgw9m/are_the_new_bosch_dishwashers_really_worse_what/,[],['dishwasher']
appliances,Did I go with the right washer and dryer?,Does anyone else have this washer and dryer? And if so what’s your experience been with it? I just got mine today and I have 14 days to return it if I want. The one thing I can say I don’t like is the high pitched noise the washer makes. I thought at first something was wrong with it but apparently this washer is suppose to sound like that. The only other thing I think I can say is that I don’t smell my laundry detergent on my cloths at all when I wash it. Is that normal? Maybe that’s a good thi,7,44,1757823799.0,https://www.reddit.com/gallery/1nghqzn,https://reddit.com/r/Appliances/comments/1nghqzn/did_i_go_with_the_right_washer_and_dryer/,[],['dryer']
appliances,First time gas oven; is this normal?,Self explanatory. Turned on to preheat at 450 and had an initial gas smell (which I expected) followed by this relatively loud blowtorch-ish noise. I don’t know if these flames seem too high? ,5,11,1757460268.0,https://v.redd.it/8h8y4xbh38of1,https://reddit.com/r/Appliances/comments/1ncyhry/first_time_gas_oven_is_this_normal/,['first time'],['oven']
appliances,Have you bought a traditional vacuum cleaner that is quieter?,"And how different was it?


I have a traditional vacuum cleaner that sucks. 

 I thought I am lazy, but then I noticed I do everything else but I don't vacuum. And my place is really at a bad state.

I realized when I think of vacuum I see jn my head the vacuum running and it's noise. And I changed my mind. 

So I assume I really do have those sensory issues.

I have autism  but I thought I can handle the sound, and I do, but then instinctively I avoid it.

I am not lazy because after I learned ",5,23,1757380106.0,https://www.reddit.com/r/Appliances/comments/1nc5ji8/have_you_bought_a_traditional_vacuum_cleaner_that/,https://reddit.com/r/Appliances/comments/1nc5ji8/have_you_bought_a_traditional_vacuum_cleaner_that/,"['how to', 'having trouble', ""don't know""]",['vacuum']
appliances,Frigidaire 30” gas range w steam clean - repairman says fan working normally,"This oven will be the end of me I swear. 

It’s brand new. Ive lived in my apartment for a few months and I’ve maybe used the oven 3 times because it’s insufferable. 

Unfortunately I’m renting and my buildings maintenance is quite hands off.  I contacted Frigidaire directly and they said it’s fixable and sent a repairman. Repairman said fan is working fine it’s just the way the air pushes through the metal in the back creating that sound (he took the fan out of the back while still running and ",4,1,1757956822.0,https://v.redd.it/7cyszby64dpf1,https://reddit.com/r/Appliances/comments/1nhs101/frigidaire_30_gas_range_w_steam_clean_repairman/,['apartment'],['oven']
appliances,Lower dishwasher sprayer melted,"Have you ever had this happen before? In all my years, I have never seen the sprayer pop off and start to melt. Want idea what caused this (I would’ve started with research on my own, but I fully know where to start with this)? I’ll be calling my home warranty tomorrow 🙃",4,9,1757902302.0,https://i.redd.it/7p4dgtvxl8pf1.jpeg,https://reddit.com/r/Appliances/comments/1nh9p6u/lower_dishwasher_sprayer_melted/,[],['dishwasher']
appliances,New washing Machine,"I’m looking for a new washing machine. We currently have a front load Electrolux machine . I think it’s a 627 model. It’s only about 6 years old but we dislike it very much. The matching dryer brunt its control board and other parts about a year ago and I’ve bought a cheap dryer to replace it. 

We would like to get a top load washing machine. Our current front load has mold in the gasket all the time. We always leave the door open on it and do wipe it every once in a while but still gets moldy.",5,11,1757898246.0,https://www.reddit.com/r/Appliances/comments/1nh8al3/new_washing_machine/,https://reddit.com/r/Appliances/comments/1nh8al3/new_washing_machine/,['cheap'],"['washing machine', 'dryer']"
appliances,(UK ONLY) Are heat pump dryers really better than traditional dryers? (Cost and drying ability wise),"Sorry in advance if i can't post this here.

I am a fulltime carer for my Mother In Law who is incontinent. She goes through two/three bedsheets a week, Cotton waterproof pads, Pyjamas etc.

Last year was a nightmare using just a cloth horse/ radiators trying to dry it but sadly it's got worse. It cost nearly £3 in the local laundrette last week to dry the sheets and pyjamas etc So, I am looking at getting a heat pump dryer.

I've only ever used a traditional one (YEARS AGO) before and it cost a",5,18,1757849172.0,https://www.reddit.com/r/Appliances/comments/1ngotm0/uk_only_are_heat_pump_dryers_really_better_than/,https://reddit.com/r/Appliances/comments/1ngotm0/uk_only_are_heat_pump_dryers_really_better_than/,[],['dryer']
BuyItForLife,things just aren’t made to last anymore,"I keep seeing posts about people saying that the subreddit is declining and while I 100% feel the same way, I don’t think it’s necessarily because of the people or anything like that. I feel like the quality of things have just declined so quickly that nothing lasts more than a few years. 

Ex. I purchased a kitchen aid mixer (Artisan) in 2022, used maybe weekly and it died on me. After reaching out to kitchen aid and my credit card to see if I could use any kind of warranty I gave up— i’m reall",1467,238,1757391662.0,https://www.reddit.com/r/BuyItForLife/comments/1nc9f7j/things_just_arent_made_to_last_anymore/,https://reddit.com/r/BuyItForLife/comments/1nc9f7j/things_just_arent_made_to_last_anymore/,['died'],['mixer']
BuyItForLife,My Grandmother’s Dryer,"Not sure of the year, but it’s “Lady Kenmore” and based on the instruction manual I’m guessing mid-late 1960’s? Still works just fine.",763,46,1757897375.0,https://www.reddit.com/gallery/1nh7zpq,https://reddit.com/r/BuyItForLife/comments/1nh7zpq/my_grandmothers_dryer/,[],['dryer']
BuyItForLife,Blendtecians - what’s the count on yours?,This blender is an absolute TANK. ,45,55,1757766111.0,https://i.redd.it/frsjsnk3dxof1.jpeg,https://reddit.com/r/BuyItForLife/comments/1nfw3x3/blendtecians_whats_the_count_on_yours/,[],['blender']
BuyItForLife,Looking to get some new kitchen knives.,"I currently have a set of Henckels knives that we got when we got married almost 5 years ago. The knives have worked well. However, they have serated blades and I am not a huge fan of that. I've been cooking a lot more recently and am wanting to upgrade my knives. I'd like something somewhat budget friendly. Id like to stay under $300. 

What I'm look for is:

8"" chief knife

5.5"" -6"" Santoku knife

A decent paring knife

And finally a knife for breaking down chuck rolls. Ive been looking at a F",44,74,1757613338.0,https://i.redd.it/m2nqak8uqkof1.jpeg,https://reddit.com/r/BuyItForLife/comments/1nefona/looking_to_get_some_new_kitchen_knives/,['budget'],"['chuck', 'blade']"
BuyItForLife,Pocket Radio!  Need help finding problem,"Okay so I included pictures so maybe someone who knows what they are looking at can help me. The only thing so far I have removed so far has been the volume button to get the “motherboard” (idk what else to call it) taken out and inspected.  I have tested it so far with a battery I know is good and when it does make a very quiet sort of shifting noise at certain frequencies, but I think that is just the volume knob movement noises. Otherwise it makes no noise.  I am going to look at it for a few",39,28,1757469108.0,https://www.reddit.com/gallery/1nd1oed,https://reddit.com/r/BuyItForLife/comments/1nd1oed/pocket_radio_need_help_finding_problem/,['need help'],['battery']
fixit,I'm going to retire this trimmer after 10+ years of faithful service because I can't get replacement guards,I had only replaced the battery a few months ago. If I had the means I'd 3d print replacements gaurds. ,36,54,1757677374.0,https://i.redd.it/3g6qlqjp0qof1.jpeg,https://reddit.com/r/fixit/comments/1nf0xl5/im_going_to_retire_this_trimmer_after_10_years_of/,[],['battery']
fixit,Robot Vacuum grabbed onto a carpet thread and this happened. Any way to fix?,Looking for a way to fix without replacing the area if possible. ,31,6,1757824451.0,https://i.redd.it/en2z14vk62pf1.jpeg,https://reddit.com/r/fixit/comments/1nghxv1/robot_vacuum_grabbed_onto_a_carpet_thread_and/,[],['vacuum']
fixit,Whirlpool oven just displays ‘stop’,"Just moved into a new apartment and we’ve got this whirlpool oven, but I have no idea how to turn it on. I’ve tried to turn all the knobs, click them in, pressed the middle button, but absolutely nothing changes. Is it defective or am I missing something…",18,57,1757810354.0,https://i.redd.it/c7yos6zn01pf1.jpeg,https://reddit.com/r/fixit/comments/1ngdfxj/whirlpool_oven_just_displays_stop/,"['how to', 'apartment']",['oven']
