subreddit,title,selftext,score,num_comments,created_utc,url,permalink,demand_signals,matched_keywords
Tools,Found this in a garage sale,"It impractically small, and hooked up to a drill",1582,144,1757444204.0,https://www.reddit.com/gallery/1ncrmt7,https://reddit.com/r/Tools/comments/1ncrmt7/found_this_in_a_garage_sale/,[],['drill']
Tools,"These tractor LED work lights make really bright flashlights. Works with 12-24V, so it can be powered with tool batteries. This is 17W and costed 8eur.",I made a 12V 4ah 18650 battery for it. It should last for around 2-2.5 hours. ,342,33,1757700454.0,https://www.reddit.com/gallery/1nfacps,https://reddit.com/r/Tools/comments/1nfacps/these_tractor_led_work_lights_make_really_bright/,[],['battery']
Tools,Cannot remember the name of this tool to save my life,"Trying to remember what this tool is called but no combination of searches leads me to this tool. It's a bit niche and very old school, but is basically a big blade with a handle that is attached to a bench with a swivel connection of some sort. I've seen it mostly used for shaping wooden spoons. Included a sketch of what the tool looks like.",284,99,1757513810.0,https://i.redd.it/906n471wicof1.jpeg,https://reddit.com/r/Tools/comments/1ndfftr/cannot_remember_the_name_of_this_tool_to_save_my/,[],['blade']
Tools,Are expensive tool brands really worth it?,"I’ve been thinking about upgrading some of my tools lately but every time I start looking around, the price gap between budget brands and the big names makes my head spin. For example, I’ll see a drill set for $80 from one brand and then a very similar setup from Milwaukee or DeWalt going for $250+. I get that higherend tools are supposed to last longer and handle tougher jobs but is it really that big of a difference in day to day use? Or is a lot of it just paying for the name? I don’t do heav",238,485,1757418818.0,https://www.reddit.com/r/Tools/comments/1ncgskv/are_expensive_tool_brands_really_worth_it/,https://reddit.com/r/Tools/comments/1ncgskv/are_expensive_tool_brands_really_worth_it/,"['expensive', 'budget', 'cheap', 'expensive', 'budget']",['drill']
Tools,The best Wirecutters I've ever used!,"Hi Guys,

Found this little guy in a lot of tools and am using it as my beater to protect my knipex. I've been using it for a few years now and it has become my favorite pair! It cut the worst stuff and the blades stay good. 

Anyone know the brand and is there a little bigger version available?",208,34,1757811303.0,https://www.reddit.com/gallery/1ngdrg9,https://reddit.com/r/Tools/comments/1ngdrg9/the_best_wirecutters_ive_ever_used/,[],['blade']
Tools,NTD! No more sockets on an impact driver for me,,148,51,1757412927.0,https://i.redd.it/mqntvdpw64of1.jpeg,https://reddit.com/r/Tools/comments/1ncezx1/ntd_no_more_sockets_on_an_impact_driver_for_me/,[],['impact driver']
Tools,"DIY Sanding Disc Holder – Simple, Cheap, and Functional (~7€ build)","I’ve been looking for a proper way to store my sanding discs for quite a while. Most of the ideas I found online were either visually boring (just a plain box with thin dividers) or way too expensive. Even the few affordable commercial options run close to 30€ for only 8 compartments.

So, I decided to make my own inexpensive and simple version. Here’s what I came up with — the whole thing cost me about 7€.


---

Materials

500mm sewage pipe (KG Rohr DN 160, Ø160 mm) – ~4€

10mm thick plywood o",142,3,1757521502.0,https://www.reddit.com/gallery/1ndiw8e,https://reddit.com/r/Tools/comments/1ndiw8e/diy_sanding_disc_holder_simple_cheap_and/,"['cheap', 'expensive', 'expensive', 'cheap', 'small space']","['drill', 'jigsaw', 'cordless']"
Dewalt,I flew from the U.S. to Scotland so I could fix my drill.,Details in the comments below. ,452,84,1757386347.0,https://www.reddit.com/gallery/1nc7pmn,https://reddit.com/r/Dewalt/comments/1nc7pmn/i_flew_from_the_us_to_scotland_so_i_could_fix_my/,[],['drill']
Dewalt,Pawned reciprocating saw is soul-bonded to its battery?,"I needed a reciprocating saw. Found this at a pawn shop. Now the battery only charges up to 1 bar and ONLY works with the saw. I have tried it on all 10 of my other dewalt tools to no use AND none of my other batteries work on the saw!

Can anyone tell me how this is possible with an otherwise universal system?",207,56,1757531716.0,https://www.reddit.com/gallery/1ndnitn,https://reddit.com/r/Dewalt/comments/1ndnitn/pawned_reciprocating_saw_is_soulbonded_to_its/,[],"['reciprocating saw', 'battery']"
Dewalt,60v string trimmer. Any good?,"Might just upgrade from my 20v

Any negative insight on this model? 

Thanks",121,102,1757705686.0,https://i.redd.it/0j1q928edsof1.jpeg,https://reddit.com/r/Dewalt/comments/1nfcka6/60v_string_trimmer_any_good/,[],['string trimmer']
Dewalt,Guy selling this as “corded sander” for $50 on marketplace but it looks like a router to me ? Maybe I’m wrong idk,,66,71,1757511104.0,https://i.redd.it/uaugi9huacof1.jpeg,https://reddit.com/r/Dewalt/comments/1ndearj/guy_selling_this_as_corded_sander_for_50_on/,[],['router']
Dewalt,Built this Stair with 2/3 of a battery charge,,66,10,1757401851.0,https://i.redd.it/oo6w0bvy93of1.jpeg,https://reddit.com/r/Dewalt/comments/1ncc7fd/built_this_stair_with_23_of_a_battery_charge/,[],['battery']
Dewalt,finally pulled the trigger,"following the latest post about drills and impacts, i got left with this one being the only option because i already have an used dcd711 with 2 5ah batteries, i wanted the 850 but i had a goddamn voucher for this specific store and they only had this one, its really light and so far i love it, i hope i wont regret not buying random stuff with the voucher and spend 120€ on 850 in another store, which made no financial sense for me. ",60,26,1757514558.0,https://i.redd.it/z4qhcej2lcof1.jpeg,https://reddit.com/r/Dewalt/comments/1ndfr9s/finally_pulled_the_trigger/,[],['drill']
Dewalt,Good deal?,"Got this, plus a router, bandsaw, and 2 tubs of old tools for 450$. Got it cleaned up and put in outdoor closet. I’m going to sell it probably, it’s a little overkill for me. What is this realistically gonna sell for if I do post it?",32,8,1757557359.0,https://www.reddit.com/gallery/1ndx5s8,https://reddit.com/r/Dewalt/comments/1ndx5s8/good_deal/,[],['router']
Dewalt,NTD!,I've wanted a router for a long time. Now i finally have one.,28,6,1757442935.0,https://i.redd.it/lo34u725o6of1.jpeg,https://reddit.com/r/Dewalt/comments/1ncr1ya/ntd/,[],['router']
Dewalt,"Battery indicator, stupid design?",I’m referring to the fact that the battery indicator is covered when you insert the battery into the tool. At least in the SDS drill and the trimmer. Couldn’t they have put it on the other side?,30,45,1757711826.0,https://i.redd.it/naaafgzovsof1.jpeg,https://reddit.com/r/Dewalt/comments/1nff5u3/battery_indicator_stupid_design/,[],"['drill', 'battery']"
Dewalt,Thinking of switching to DeWalt,"Hey everyone,

I’m considering buying into the DeWalt platform. Up until now I’ve only used Bosch, but all my old batteries are shot, so I figure it might be time to start fresh.

I’m mostly a DIYer, but I’ve got a property I need to renovate, and I want the mobility of cordless tools since one of my places is a good distance from the road. That’s why the Flexvolt lineup – especially the table saw and miter saw – looks really promising to me. I also got an offer on a couple of 12Ah batteries.

M",22,30,1757845275.0,https://www.reddit.com/r/Dewalt/comments/1ngnosg/thinking_of_switching_to_dewalt/,https://reddit.com/r/Dewalt/comments/1ngnosg/thinking_of_switching_to_dewalt/,[],"['drill', 'miter saw', 'table saw', 'cordless']"
Dewalt,Grabbed a DCG410 4-1/2” Angle Grinder Kit with 8AH PowerPack and fast charger on clearance at Lowe’s for $122.,"Didn’t have an angle grinder and not sure if I needed one, but seemed like a pretty good deal so I snagged one. ",27,17,1757946147.0,https://www.reddit.com/gallery/1nhn87u,https://reddit.com/r/Dewalt/comments/1nhn87u/grabbed_a_dcg410_412_angle_grinder_kit_with_8ah/,[],['angle grinder']
Dewalt,"[CANADA] - 12"" chainsaw kit on clearance at HD for $198","Great deal, usually just the saw is this much on sale!",18,15,1757432186.0,https://i.redd.it/y99seqw5s5of1.jpeg,https://reddit.com/r/Dewalt/comments/1ncm80c/canada_12_chainsaw_kit_on_clearance_at_hd_for_198/,[],['chainsaw']
Dewalt,I broke my weed wacker and I have no idea how to fix it but I want to try.,"After I finished weed wacking, I went and pressure washed my 40v Max XR Brushless weed wacker. (Yes I know that water and electrical components don't mix well. I wish I thought of that before I went and cleaned it). I have pressure washed it before in the past and it worked fine. I even forgot that I left it outside a few times and it still worked. Now it doesn't work and I really want to fix it because we've had it for a very long time and it's a great electric weed wacker. I decided to take ap",15,26,1757449129.0,https://www.reddit.com/gallery/1nctwdb,https://reddit.com/r/Dewalt/comments/1nctwdb/i_broke_my_weed_wacker_and_i_have_no_idea_how_to/,['how to'],['brushless']
Dewalt,Good deal? (Canada),Looking at getting a new impact driver. Can’t decide if this is worth the money or not. ,11,16,1757601909.0,https://i.redd.it/40j0pqvusjof1.jpeg,https://reddit.com/r/Dewalt/comments/1neaqt6/good_deal_canada/,[],['impact driver']
Makita,Since we’re doing XGT hammer drills…,Used this to destroy some stumps.   It’s a beast but the drill did not like this task….after 20 minutes of repeatedly drilling ash stumps it got extremely hot and started to make a smell.   I gave it a rest and decided to use a different tool (more to come soon on that),62,12,1757674477.0,https://i.redd.it/prnt2ymmspof1.jpeg,https://reddit.com/r/Makita/comments/1nf00zb/since_were_doing_xgt_hammer_drills/,[],['drill']
Makita,New XGT three-speed 150 Nm hammer drill HP003G,Source: [https://www.makita.de/data/pam/public/01\_kataloge/801624\_neuheiten\_herbst\_2025\_mail.pdf](https://www.makita.de/data/pam/public/01_kataloge/801624_neuheiten_herbst_2025_mail.pdf),48,27,1757659344.0,https://i.redd.it/56h5eweljoof1.png,https://reddit.com/r/Makita/comments/1new2yi/new_xgt_threespeed_150_nm_hammer_drill_hp003g/,[],['drill']
Makita,Makita 1019L shadow line add. Keeping laser too,"I just build an aluminum base , drill an small hole and fix it . Adding thread lock for security.
I bought led light 12 V for cars. Very cheap. And make this beauty .
I will add cable Organizers that I already order. But here is the installation. Tomorrow i’ll show the results!
",17,3,1757803222.0,https://www.reddit.com/gallery/1ngawz5,https://reddit.com/r/Makita/comments/1ngawz5/makita_1019l_shadow_line_add_keeping_laser_too/,['cheap'],['drill']
Makita,18v 5.0ah battery - best way to buy?,"I've been a Milwaukee M12 guy but got into Makita 18v when I bought their weedeater and blower. Both impressed me for the weight and power.

I'm looking to pick up another battery so I can have one for each tool.

Outright at retail, the 5.0ah battery is around $125 but does it ever get cheaper during black friday or holiday sales?

Or is this one of the cases where you are better off spending a little more for a tool + battery combo where you are basically getting the battery for super cheap.",13,19,1757714099.0,https://www.reddit.com/r/Makita/comments/1nfg3xd/18v_50ah_battery_best_way_to_buy/,https://reddit.com/r/Makita/comments/1nfg3xd/18v_50ah_battery_best_way_to_buy/,"['cheap', 'cheap']",['battery']
Makita,Makita vs blue Bosch?,"Hi all.

Recently I've seen a ""Why Makita?"" post here with lot's of interesting opinions & stories on Makita tools in general, and especially vs the Milwaukee brand.

I was wondering how would you compare  Makita LXT (maybe together with XGT to be fair) against Bosch blue 18V tools. Like either as a general comparison or within the scope of woodworking. I'm thinking saws, router etc. tools.

It seems Bosch has released a lot of stuff recently, and keeps pumping new tools every quarter. Tabless 1",8,35,1757935755.0,https://www.reddit.com/r/Makita/comments/1nhj96l/makita_vs_blue_bosch/,https://reddit.com/r/Makita/comments/1nhj96l/makita_vs_blue_bosch/,['new to'],['router']
Makita,Can anyone explain why my impact isn’t working correctly?,"Got this drill in January for work. I use it about 3 working hours a day, 3 times a week. Recently it has started acting up, I pull the trigger and sometimes nothing happens, sometimes it spins at low speed, and sometimes it operates as intended (this has been happening less and less recently). This problem started maybe two months ago, and has developed to a point where I can no longer consistently use the tool. I’ve included a video to demonstrate what I mean. I work as a commercial route sett",8,10,1757870792.0,https://v.redd.it/0rkxhuqa06pf1,https://reddit.com/r/Makita/comments/1ngx9f3/can_anyone_explain_why_my_impact_isnt_working/,[],['drill']
Makita,Makita HR2470.9,"I have this makita hammer drill and it doesn't work while in only hammer mode, it does the same as in hammer drill mode. I thought there might be a problem in the case where the gears are but when i opened it a small keyed cylinder fell out and i don't know where it's supposed to be.",5,9,1757425594.0,https://www.reddit.com/gallery/1ncjdjl,https://reddit.com/r/Makita/comments/1ncjdjl/makita_hr24709/,"[""don't know""]",['drill']
Makita,Makita Bl1840b better than 1850b?,"Hello Makita lovers! 

Between my many batteries have also 1840b, I usually keep for my stick vac but this weekend I needed for clearing some weeds sound house with Dux60 string trimmer .

Used at full power to clear some weeds between bricks and I noticed very good performance and very Less heat on the battery respect to bl1850.

Are the cells with higher discharge rate than 1850?  If so it s a pity I didn't get more of than instead of 1850!!

Thanks for comments!
",3,7,1757831051.0,https://www.reddit.com/r/Makita/comments/1ngjsj2/makita_bl1840b_better_than_1850b/,https://reddit.com/r/Makita/comments/1ngjsj2/makita_bl1840b_better_than_1850b/,[],"['string trimmer', 'battery']"
Makita,125mm Japan only Circular saw,"I’m kind of on the hype train for the 125mm skilly, but given I can get the 165 for the same price here in nz (accounting for shipping the 125 to nz). Is the 125 all it’s cracked up to be? Don’t use a skilly very often, but when I do it’s to cut sheet goods and the odd 4x2, in that case it seems like the 125 would be perfect? 

What are people’s thoughts from people who have both/have used both.

Thank you 🙏 ",3,7,1757908205.0,https://www.reddit.com/r/Makita/comments/1nhbo6e/125mm_japan_only_circular_saw/,https://reddit.com/r/Makita/comments/1nhbo6e/125mm_japan_only_circular_saw/,[],['circular saw']
Makita,Straight vs angled finish nailer?,"I currently own makita quiet series compressor and ridgid 16 gauge straight nailer and 18 gauge brad. Makita just announced the new XNB04z (18g), XNB05z (straight) and XNB06z (angled) 16 gauge nailers and really want to go cordless for convenience. I replaced some baseboards and door casing, and a few door stops with my current tools. I searched for a few days but didn’t find the answer I was looking for, or videos or pictures showing examples. I have a few questions, Why is the angled finish na",3,2,1757562326.0,https://www.reddit.com/r/Makita/comments/1ndyrc3/straight_vs_angled_finish_nailer/,https://reddit.com/r/Makita/comments/1ndyrc3/straight_vs_angled_finish_nailer/,['does anyone know'],['cordless']
Makita,18v vs 36v angle drill,"Is there much of a difference between the two ? Is the 36v worth getting over the 18v? 
I won’t need to use it every day, don’t want to kill 2 battery’s at once if the 18v is capable on its own ",1,8,1757684801.0,https://www.reddit.com/r/Makita/comments/1nf3p2v/18v_vs_36v_angle_drill/,https://reddit.com/r/Makita/comments/1nf3p2v/18v_vs_36v_angle_drill/,[],"['drill', 'battery']"
Makita,2 xph14z broke in 1 year,"Just trying to figure out if I'm doing something  wrong or have i just gotten two duds?
I typically use it with a 3/4 or 1/2 inch auger drill bit on wood studs I'm a residential apprentice electrician so i do drill a good amount of holes but the drills didn't ever get any hotter than my dewalt xr drill. Each time
It has broke it's been in the 2 position ",1,20,1757635244.0,https://www.reddit.com/r/Makita/comments/1neokse/2_xph14z_broke_in_1_year/,https://reddit.com/r/Makita/comments/1neokse/2_xph14z_broke_in_1_year/,[],['drill']
Makita,Brand new bit has some weird buildup,"I bough a brand new drill bit and this is what the tip looks like (kinda gold substance, really hard)",1,18,1757614122.0,https://v.redd.it/w79e3nq5tkof1,https://reddit.com/r/Makita/comments/1neg14z/brand_new_bit_has_some_weird_buildup/,[],['drill']
Makita,Makita 6271D battery repair/conversion?,"Hi everyone, glad to be here, I recently serviced my Dad's old Makita drill the 6271D, it works great, but there's a small downside, the batteries are old, and I was thinking of either repairing them or converting them to Lithium-Ion, question is, if I convert it to Li-Ion will the original charger still work? Would I need a new BMS? Has anyone ever done something like this to give me a rough plan? I know I could just buy a new knockoff battery and it would work just as good, but I like the proc",1,6,1757568818.0,https://www.reddit.com/r/Makita/comments/1ne0n60/makita_6271d_battery_repairconversion/,https://reddit.com/r/Makita/comments/1ne0n60/makita_6271d_battery_repairconversion/,[],"['drill', 'battery']"
Ryobi,Picked up these clearance puppies - keepers??,"PBLHM101B Hammer Drill $45
PBLID02B 4 mode Impact $41
P611 Planer $30

Found these while blundering around a couple HD stores. Not sure whether they are good enough to keep, or return if not and wait for the newer versions on sale. Thinking of upgrading my brushed big drill & impact and giving old ones to my kid. I have the compact brushless pair also for lighter work. And I have an ancient corded Craftsman planer. The HD guy who fished the drill out of the overhead sort of talked me into the pl",39,12,1757473271.0,https://i.redd.it/7r64l4nb69of1.jpeg,https://reddit.com/r/ryobi/comments/1nd3444/picked_up_these_clearance_puppies_keepers/,[],"['drill', 'planer', 'brushless']"
Ryobi,This would be cool if they made it,"Spotted this today. First thing I thought is a USB lithium battery could 100% fit in the handle. If Ryobi made a true USB lithium screwdriver, I would definitely buy it. Anyone with me?",25,32,1757881965.0,https://i.redd.it/m8804kulx6pf1.jpeg,https://reddit.com/r/ryobi/comments/1nh22du/this_would_be_cool_if_they_made_it/,[],['battery']
Ryobi,If anyone ever talks bad about you using Ryobi remember they used to carry the weight of a American icon on its back,"Yes if I'm correct most craftsman drills around this time period were Ryobi (among other things like table saws) even up to the later C3 architecture.

No the old Ryobi isn't my main trade drill it's a novelty",24,39,1757659455.0,https://www.reddit.com/gallery/1new40v,https://reddit.com/r/ryobi/comments/1new40v/if_anyone_ever_talks_bad_about_you_using_ryobi/,[],"['drill', 'table saw']"
Ryobi,What’s This Called? Please Help!,"Bought a RYOBI ONE  18V Cordless 7 1/2 in. Bucket Top Misting Fan. 

Dumbass dog ate the tube that feeds water from the bucket. 🫩
Looking for a replacement but everything I search brings up the water hose replacement (which is in good shape so I don’t need that)

Please help. What’s THIS tube that feeds water from the bucket called?

Thank you. 😭",19,17,1757475305.0,https://i.redd.it/dg8ja3cec9of1.jpeg,https://reddit.com/r/ryobi/comments/1nd3s2f/whats_this_called_please_help/,[],['cordless']
Ryobi,Is my weed wacker on its last wack?,"I’ve had this thing for 2 years, using it for 4-5 months out of the year and using it twice every weekend. It’s started to smell like something’s burning, and it’s starting to work very inefficiently with it being probably only 40% of its maximum power with a full battery. It gets random bursts of power as you can probably hear in the video, if it is nearing its last wack, I’m most likely going to buy a Milwaukee next.",17,15,1757628752.0,https://v.redd.it/2u04blql0mof1,https://reddit.com/r/ryobi/comments/1nem7bq/is_my_weed_wacker_on_its_last_wack/,[],['battery']
Ryobi,Impact Drill,"My first impact driver. 
Any recommendations on Which adapted and socket to get for it.  
Will I able to unscrew car lug nuts with it? 
It’s okay to use 2Ah battery with it? 
Thanks ",13,28,1757861590.0,https://i.redd.it/p1j1aorx85pf1.jpeg,https://reddit.com/r/ryobi/comments/1ngtb56/impact_drill/,['recommend'],"['drill', 'impact driver', 'battery']"
Ryobi,Battery storage maintenance,"I'm a lightweight DIYer. So I started with the Ryobi drill-and-driver set with 2 batteries. Then I bought a few more of the basic ones (circular saw, recip, and such) for specific projects. And kept my eyes peeled for battery specials at HD. I gave some tools to family members, along with batteries. Bought inflators, a vacuum, a trim router, a bigger circular saw. And still kept my eyes peeled for battery specials. Then along came the pandemic, and some local power problems here in NorCal, so I ",10,11,1757541764.0,https://www.reddit.com/r/ryobi/comments/1ndrndr/battery_storage_maintenance/,https://reddit.com/r/ryobi/comments/1ndrndr/battery_storage_maintenance/,[],"['drill', 'circular saw', 'router', 'battery', 'vacuum']"
Ryobi,Anyone ever use the seat warmer?,How’s the battery life and heat level?,8,10,1757708783.0,https://www.reddit.com/r/ryobi/comments/1nfdvdf/anyone_ever_use_the_seat_warmer/,https://reddit.com/r/ryobi/comments/1nfdvdf/anyone_ever_use_the_seat_warmer/,[],['battery']
Ryobi,"Ryobi battery left in the rain, now lights 2-4 stay on, is it toast?",,6,9,1757800807.0,https://i.redd.it/uvm3gm4a80pf1.jpeg,https://reddit.com/r/ryobi/comments/1ng9zwv/ryobi_battery_left_in_the_rain_now_lights_24_stay/,[],['battery']
Ryobi,"Charger needed for older Ryobi BSPL1213 Power Tools (2500 mAh, Li-ion, 12 V)","Have been trawling the net, eBay etc. here in the UK.  Is there an aftermarket charger that will work for the batteries that are still good for this lightweight drill that husband hates to part with?  He has the later models which are heavier, and he would like to keep this one going if he can get a replacement charger as the original has packed up.  I see that you can buy the batteries, so is there a charger option out there?  Or an adapter that goes into the more modern chargers as the battery",7,13,1757780110.0,https://i.redd.it/oglq5ol5gyof1.jpeg,https://reddit.com/r/ryobi/comments/1ng1jnt/charger_needed_for_older_ryobi_bspl1213_power/,[],"['drill', 'battery']"
Ryobi,Is this normal,"Just purchased a Ryobi combi drill. When using, I noticed it sparking in the motor. I've never seen this before in any other drill I've had. Is this to be expected?",6,9,1757935570.0,https://v.redd.it/4x0itmdzcbpf1,https://reddit.com/r/ryobi/comments/1nhj75h/is_this_normal/,[],['drill']
Ryobi,What's the best way to buy two 4 Ah batteries?,"I'm talking 18 volt. HD has it for $79. So that's one way. But I keep seeing how people mention ""if you look for a sale you can get batteries much cheaper"". That or getting a free tool with batteries. Or other promotions.

I don't need the batteries right away. Maybe within a month or two. Do various sales come up often? Or should I just buy the batteries for $79 and be done with it?

What's a good way to know about current and upcoming promotions and deals to tools and batteries?

I'm new to co",5,15,1757775519.0,https://www.reddit.com/r/ryobi/comments/1nfzm6p/whats_the_best_way_to_buy_two_4_ah_batteries/,https://reddit.com/r/ryobi/comments/1nfzm6p/whats_the_best_way_to_buy_two_4_ah_batteries/,"[""what's the best"", 'cheap', 'new to']",['cordless']
Ryobi,How to fix battery / charger?,"I was searching and couldn’t find this specific issue so hope this is a valid post. 

Problem: battery won’t charge. 

Plugging the empty charger into the wall results in a solid red light. As soon as I insert the battery into the charger, the charger indicator light flashes red for about 5 seconds and then goes solid green. But the battery indicator light still flashes only 1 green bar and the appliances do not work with this battery. 

Specs: 18v 2Ah battery, PCG002 charger

Please let me know",3,0,1757853208.0,https://www.reddit.com/r/ryobi/comments/1ngq508/how_to_fix_battery_charger/,https://reddit.com/r/ryobi/comments/1ngq508/how_to_fix_battery_charger/,['how to'],['battery']
Ryobi,HELP with RY40108,"I have a RY40108 lawn mower, and my son accidentally pulled the handle bars too hard, which caused them to come off. The small cord attached to the handle also broke. Is this something that can be fixed? I would really appreciate any advice or help, especially budget-friendly options since I am a single mom currently out of work. Thank you so much in advance.",3,1,1757541270.0,https://www.reddit.com/r/ryobi/comments/1ndrgdu/help_with_ry40108/,https://reddit.com/r/ryobi/comments/1ndrgdu/help_with_ry40108/,"['help with', 'advice', 'budget']",['lawn mower']
